http://www.semanticweb.org/ontologies/2022/titutuli/nivedita/drmo#bibliographyType,http://purl.org/dc/terms/identifier,http://purl.org/dc/terms/creator,http://purl.org/dc/terms/title,http://purl.org/dc/terms/source,http://purl.org/ontology/bibo/volume,http://www.semanticweb.org/ontologies/2022/titutuli/nivedita/drmo#number,http://purl.org/ontology/bibo/pages,http://www.semanticweb.org/ontologies/2022/titutuli/nivedita/drmo#yearPublished,http://www.w3.org/2004/02/skos/core#note,http://purl.org/ontology/bibo/uri,http://purl.org/dc/terms/abstract,http://www.semanticweb.org/ontologies/2022/titutuli/nivedita/drmo#keywords
7,ALHIJAZI2023e15326,"Al-hijazi, Athraa Y.; Hasan, Nada; Nasr, Bassem Karim; Jasim Al-Khafaji, Hanadi Hadi; Al-Khafaji, Buthaina; Abdah Alanssari, Bahaa Fawzi; Jalil, Abduladheem Turki",Recent advances in the use of inorganic nanomaterials as anti caries agents,Heliyon,9,4,e15326,2023,,https://www.sciencedirect.com/science/article/pii/S2405844023025331,"Caries is the most prevalent and widespread chronic oral disease. Traditional caries filling materials, due to their lack of anti-caries capabilities, can readily develop secondary caries. Nanomaterials proposed as an effective approach for caries treatment can inhibit biofilm formation. It also can not only reduce demineralization but also promote remineralization. In recent years, nanotechnology in anti-caries materials, particularly nano-adhesive and nano-composite resin, has advanced rapidly. Because inorganic nanoparticles (NPs) interfere with bacterial metabolism and inhibit biofilm development, inorganic NPs have emerged as a new trend in dental applications. Metal and metal oxide NPs by releasing metal ions, oxidative stress induction, and non-oxidative mechanisms showed significant antimicrobial activity. For applying metal and metal oxide NPs as anti caries agents, silver, zinc, titanium, copper, and calcium ions have been shown significant attention. Moreover, fluoride functionalized inorganic NPs were also employed to improve their efficacy of them. The fluoride-functionalized NPs can promote remineralization, and inhibit demineralization by enhancing apatite formation. In this review, we have provided an overview and recent advances in the use of inorganic NPs as anti caries agents. Furthermore, their antimicrobial, remineralizing, and mechanical impacts on dental materials were discussed.","Anti-caries, Biofilm, Inorganic, Metal, Remineralization"
7,CHEN2023105075,"Chen, Xiangsheng; Shen, Jun; Bao, Xiaohua; Wu, Xianlong; Tang, Waiching; Cui, Hongzhi",A review of seismic resilience of shield tunnels,Tunnelling and Underground Space Technology,136,,105075,2023,,https://www.sciencedirect.com/science/article/pii/S0886779823000950,"Considering the increasingly complex and interconnected subway tunnels linking cities, this review argues that the overall reliability of tunnel engineering is crucial for protection when subjected to loads caused by major catastrophes, particularly earthquakes. Therefore, the key topic of this paper is the application of the resilience concept for shield tunnel structure seismic resilience assessment. In the review, from the technical perspective of civil engineering, based on the five characteristics of resilience, four aspects regarding the seismic resilience of shield tunnels were presented: failure mode and damage mechanism, seismic design method, prevention measures and post-earthquake repair of shield tunnels. First, the definition of seismic resilience of shield tunnel is introduced. Then the failure modes of the shield tunnel under the seismic action and mechanism of damage were summarised under two types: global and local. Consequently, based on the design, several seismic calculation methods were analysed. Next, the current understanding and exploration of shield tunnels in the construction and repair stages were described. Because of lack of relevant repair cases following earthquakes, this review provides a summary of the newly developed techniques and methods of the shield tunnel, which are used to improve seismic resilience during operation. Further, the limitation of the current research were summarised, followed by a short discussion on improving the resilience of shield tunnels in terms of seismic design, construction, operation, and post-earthquake repairs. The final aim is to develop a robust and suitable tool to enhance and maintain shield tunnel resilience, starting from the weaknesses of the tunnel structure faced with earthquakes.","Shield tunnel, Earthquake, Resilience, Recoverable, Detection and repair"
7,CHEN2023100635,"Chen, Zetong; Chu, Zhaoyou; Jiang, Yechun; Xu, Lingling; Qian, Haisheng; Wang, Yuanyin; Wang, Wanni",Recent advances on nanomaterials for antibacterial treatment of oral diseases,Materials Today Bio,20,,100635,2023,,https://www.sciencedirect.com/science/article/pii/S2590006423000959,"An imbalance of bacteria in oral environment can lead to a variety of oral diseases, such as periodontal disease, dental caries, and peri-implant inflammation. In the long term, in view of the increasing bacterial resistance, finding suitable alternatives to traditional antibacterial methods is an important research today. With the development of nanotechnology, antibacterial agents based on nanomaterials have attracted much attention in dental field due to their low cost, stable structures, excellent antibacterial properties and broad antibacterial spectrum. Multifunctional nanomaterials can break through the limitations of single therapy and have the functions of remineralization and osteogenesis on the basis of antibacterial, which has made significant progress in the long-term prevention and treatment of oral diseases. In this review, we have summarized the applications of metal and their oxides, organic and composite nanomaterials in oral field in recent five years. These nanomaterials can not only inactivate oral bacteria, but also achieve more efficient treatment and prevention of oral diseases by improving the properties of the materials themselves, enhancing the precision of targeted delivery of drugs and imparting richer functions. Finally, future challenges and untapped potential are elaborated to demonstrate the future prospects of antibacterial nanomaterials in oral field.","Dental, Nanomaterials, Antibacterial, Oral, Remineralization"
7,NASIRITABRIZI20237142,"Nasiri-Tabrizi, Bahman; Basirun, Wan Jefrey; Yeong, Chai Hong; Thein, Win Min","Development of the third generation of bioceramics: Doping hydroxyapatite with s-, p-, d-, and f-blocks cations and their potential applications in bone regeneration and void filling",Ceramics International,49,5,7142-7179,2023,,https://www.sciencedirect.com/science/article/pii/S0272884222045308,"The bioceramic market is expected to grow at a compound annual growth rate (CAGR) of about 7% within 2022–2027. In this regard, hydroxyapatite (HA) is highly recommended as a leading material for the development of the third generation of bioceramics due to its intrinsic osteoconduction, osteoinduction, and osteogenesis properties. However, the use of synthetic HA is currently limited due to the unfavourable mechanical and morphological issues on cell infiltration and interaction. To overcome these obstacles, various strategies have been proposed, especially through a wide range of cationic and anionic doping. Among them, cationic doping seems to have a set of significant benefits over pure HA due to the significant microstructural modifications, and thus this strategy represents a major step forward in improving the inherent drawback of bioceramic implants, i.e., their poor mechanical properties. Accordingly, this review aims to highlight candidates with potential for further clinical development of the third-generation bioceramics through doping HA with s-, p-, d-, and f-blocks cations and to explore their potential applications in bone regeneration and void filling. We first introduce the concept of bone grafting and its classifications, and then we discuss bioceramic-based bone grafting materials. Subsequently, mono-, dual-, and multi-cationic substitutions in HA and their performances, especially in biomedical applications, are comprehensively reviewed. Finally, the challenges and prospects of ionic substitution in HA, particularly in lanthanoids- and actinoids-containing HA-based ceramics are proposed.","Hydroxyapatite, Cationic substitution, Structural features, Mechanical behaviour, Biological properties, Bone void filling"
7,GOMASA2023133179,"Gomasa, Ramesh; Talakokula, Visalakshi; Kalyana Rama Jyosyula, Sri; Bansal, Tushar",A review on health monitoring of concrete structures using embedded piezoelectric sensor,Construction and Building Materials,405,,133179,2023,,https://www.sciencedirect.com/science/article/pii/S0950061823028969,"Concrete commonly constitutes approximately fifty percent in building constructions and its significance extends even further, often exceeding fifty percent in infrastructure projects such as dams and marine structures. Consequently, ensuring the integrity of concrete structures is crucial both during their construction phase and under service loads. Therefore, it becomes imperative to monitor various phases of the concrete life cycle encompassing construction (strength monitoring), service life (damage monitoring under different loading conditions and durability monitoring when exposed to different environmental exposures) to avoid potential catastrophic failures. Over the last two decades, structural health monitoring (SHM) using different piezo sensor configurations have gained a lot of interest among researchers for monitoring concrete structures due to their non-destructive nature, real-time monitoring capabilities, early damage detection and potential for reducing downtime and costs. Among the different piezo configurations, embedded piezo sensor has gained significant attentions as it allows monitoring from the time concrete is poured. This paper provides a comprehensive review of embedded piezo sensor configuration for monitoring the different life stages of concrete structures. Based on their manufacturing, these sensors are initially classified into different clusters and their performance is evaluated for each SHM application covering various phases of concrete life cycle. The present review summarizes the existing knowledge of using embedded piezo sensors for SHM, making it easier for researchers to get up to speed on the state of the art and identify unexplored areas, and start a further investigation.","Structural health monitoring, Embedded piezoelectric sensors, Concrete, Strength monitoring, Damage identification, Durability monitoring"
7,BENDIXEN2023101364,"Bendixen, Mette; Noorbhai, Nakiya; Zhou, Joy; Iversen, Lars Lønsmann; Huang, Ke",Drivers and effects of construction-sand mining in Sub-Saharan Africa,The Extractive Industries and Society,16,,101364,2023,,https://www.sciencedirect.com/science/article/pii/S2214790X23001533,"Construction-sand is the most used solid material on Earth and is central in developing societies and economies. Recent years’ increasing focus on scarcity of sand has focused on global issues arising from it and on environmental consequences of extraction. However, comprehensive research describing the complexity of sand mining in developing nations is lacking. Here, we review literature from Sub-Saharan Africa outlining drivers and effects of construction-sand. We show at regional and national level, population growth and rapid urbanisation are main drivers for the growing sand mining activities observed in all investigated countries. Environmental consequences are solely negative and often observed at or in the vicinity of the mining sites and can be immediate or occur later. For humans and the built environment, the positive effects are seen at a variety of levels spanning national and regional through the creation of necessary buildings, income, taxes, and revenues. At an individual level, little or low education, unemployment and disruption of traditional livelihoods are main drivers for people engaging in sand mining by offering an income. Extraction of the material has negative consequences in the form of pollution and destruction of infrastructure and impact not only people involved in the mining industry but also nearby communities.","Sand mining, Urbanisation, Livelihood, Environmental degradation, Economic development"
7,FATHIKARKAN2023104805,"Fathi-karkan, Sonia; Zeeshan, Mahira; Qindeel, Maimoona; Eshaghi Malekshah, Rahime; Rahdar, Abbas; Ferreira, Luiz Fernando Romanholo",NPs loaded with zoledronic acid as an advanced tool for cancer therapy,Journal of Drug Delivery Science and Technology,87,,104805,2023,,https://www.sciencedirect.com/science/article/pii/S1773224723006573,"Zoledronic acid (ZA) has been shown to be beneficial against cancer both directly and indirectly. However, because of its fast absorption by bone, its use in extraskeletal malignancies has been limited. Due to its quick blood clearance, ZA is less effective as a cancer treatment. To utilize the numerous therapeutic properties of ZA, novel delivery strategies are necessary. While maintaining its pharmacological properties, nanomedicine is an excellent method of increasing ZA's circulatory half-life and intratumor accumulation. Nanoparticles (NPs) can enhance drug accumulation in neoplastic tissues by utilizing the increased permeability and retention effect (EPR) of fenestrations in tumor arteries. Loading the molecules inside the NP increases the solubility and stability of the drug and inhibits breakdown by serum proteins. Additionally, the release of the drug could be controlled, preventing early leakage.","Zoledronic acid, NPs, Cancer therapy, Nanomedicine"
7,SETHI2023162213,"Sethi, Shradhanjali; Gupta, Rohan; Bharshankh, Ankita; Sahu, Rojalin; Biswas, Rima",Celebrating 50 years of microbial granulation technologies: From canonical wastewater management to bio-product recovery,Science of The Total Environment,872,,162213,2023,,https://www.sciencedirect.com/science/article/pii/S004896972300829X,"Microbial granulation technologies (MGT) in wastewater management are widely practised for more than fifty years. MGT can be considered a fine example of human innovativeness-driven nature wherein the manmade forces applied during operational controls in the biological process of wastewater treatment drive the microbial communities to modify their biofilms into granules. Mankind, over the past half a century, has been refining the knowledge of triggering biofilm into granules with some definite success. This review captures the journey of MGT from inception to maturation providing meaningful insights into the process development of MGT-based wastewater management. The full-scale application of MGT-based wastewater management is discussed with an understanding of functional microbial interactions within the granule. The molecular mechanism of granulation through the secretion of extracellular polymeric substances (EPS) and signal molecules is also highlighted in detail. The recent research interest in the recovery of useful bioproducts from the granular EPS is also emphasized.","Microbial granulation technologies, Full-scale applications, Microbial interactions, EPS, Quorum sensing, Recovery of bioproducts"
7,MANTESSO20231048,"Mantesso, Andrea; Nör, Jacques E.",Stem cells in clinical dentistry,The Journal of the American Dental Association,154,12,1048-1057,2023,,https://www.sciencedirect.com/science/article/pii/S0002817723004889,"Background Stem cells are present in most of the tissues in the craniofacial complex and play a major role in tissue homeostasis and repair. These cells are characterized by their capacity to differentiate into multiple cell types and to self-renew to maintain a stem cell pool throughout the life of the tissue. Types of Studies Reviewed The authors discuss original data from experiments and comparative analyses and review articles describing the identification and characterization of stem cells of the oral cavity. Results Every oral tissue except enamel, dentin, and cementum contains stem cells for the entire life span. These stem cells self-renew to maintain a pool of cells that can be activated to replace terminally differentiated cells (for example, odontoblasts) or to enable wound healing (for example, dentin bridge in pulp exposures and healing of periodontal tissues after surgery). In addition, dental stem cells can differentiate into functional blood vessels and nerves. Initial clinical trials have shown that transplanting dental pulp stem cells into disinfected necrotic teeth has allowed for the recovery of tooth vitality and vertical and horizontal root growth in immature teeth with incomplete root formation. Practical Implications As a consequence of these groundbreaking discoveries, stem cell banks are now offering services for the cryopreservation of dental stem cells. The future use of stem cell–based therapies in the clinic will depend on the collaboration of clinicians and researchers in projects designed to understand whether these treatments are safe, efficacious, and clinically feasible.","Tissue engineering, tissue regeneration, mesenchymal stem cells, stemness, multipotency, regenerative dentistry"
7,ZHANG2023100101,"Zhang, Luchang; Ma, Xingjian; Chen, Zhiyu; Wang, Chunying; Liu, Zicheng; Li, Xiang; Xing, Xiaoying",Negative effects of artificial nest boxes on birds: A review,Avian Research,14,,100101,2023,,https://www.sciencedirect.com/science/article/pii/S2053716623000270,"Artificial nest boxes are placed to attract birds to nest and breed in a specific location, and they are widely used in avian ecology research and in the attraction of insectivorous birds. There is evidence that artificial nest boxes can adversely affect breeding fitness but no great focus has been placed on this issue by researchers. Therefore, we retrieved 321 research papers regarding artificial nest boxes published from 2003 to 2022 and used the ‘Biblioshiny’ program to extract and integrate keywords; we then summarized the adverse effects of artificial nest boxes on avian breeding success. The studies highlighted many drawbacks and misuses in the designing and placement of nest boxes; furthermore, bird attraction was decreased by their inappropriate selection, thus reducing breeding success. Regarding nest box production, there were shortcomings in the construction material, color, smell, and structural design of the boxes used. Nest boxes were also placed at inappropriate densities, locations, orientations, heights, and managed incorrectly. Finally, we propose suggestions for more efficient and safer artificial nest boxes for future use in avian ecology research and bird conservation.","Artificial nest box, Avian breeding, Management, Negative effect, Nest box hanging, Nest box location, Nest box structure"
7,PATEL2023113471,"Patel, S.; Veerasamy, V. S.; St. John, J. P.; Orlov, A.","A comprehensive review on dust removal using electrodynamic shield: Mechanism, influencing factors, performance, and progress",Renewable and Sustainable Energy Reviews,183,,113471,2023,,https://www.sciencedirect.com/science/article/pii/S1364032123003283,"Dust accumulation on the surface of solar harvesting devices can significantly reduce energy yield. Electrodynamic Shield (EDS) technology can remove dust via an electric field generated on the top layer of the solar harvesting devices. This technology does not require the use of water and can operate with a fraction of the power generated by the solar harvesting devices. The electric field is generated by applying a voltage across electrodes deposited on the surface of the solar harvesting devices. Extensive research is being carried out to: (1) Identify and characterize important parameters and their effect on the cleaning efficiency of the EDS, (2) improve the optical transmission and conductive properties of the electrodes, and (3) develop scalable electrode coatings. This review paper discusses the current state of research on EDS technology, mechanisms of dust removal, parameters that determine cleaning efficiency, and recent advances in the application of EDS for both space and terrestrial applications. The literature on the impact of electrode geometry is less than adequately needed to understand its effects on cleaning efficiency. The independent role of frequency and waveshape applied to an EDS remains an open research question. The main challenges that need to be addressed before this technology can be successfully implemented on a large scale include: (1) increasing the efficiency of fine dust particle removal while optimizing for power consumption, (2) further experimental validation of theoretical models built to calculate cleaning efficiency for simulated EDS, and (3) exploring new materials to manufacture electrodes at scale.","Soiling, Dust removal, Self-cleaning, Electrodynamic shield, Solar panel efficiency, Photovoltaics (PV), Concentrating solar power (CSP)"
7,FAN2023119837,"Fan, Yuanyuan; Sun, Shanshan; He, Shengbing",Iron plaque formation and its effect on key elements cycling in constructed wetlands: Functions and outlooks,Water Research,235,,119837,2023,,https://www.sciencedirect.com/science/article/pii/S0043135423002725,"Ecological restoration of wetland plants has emerged as an environmentally-friendly and less carbon footprint method for treating secondary effluent wastewater. Root iron plaque (IP) is located at the important ecological niches in constructed wetlands (CWs) ecosystem and is the critical micro-zone for pollutants migration and transformation. Root IP can affect the chemical behaviors and bioavailability of key elements (C, N, P) since its formation/dissolution is a dynamic equilibrium process jointly influenced by rhizosphere habitats. However, as an efficient approach to further explore the mechanism of pollutant removal in CWs, the dynamic formation of root IP and its function have not been fully studied, especially in substrate-enhanced CWs. This article concentrates on the biogeochemical processes between Fe cycling involved in root IP with carbon turnover, nitrogen transformation, and phosphorus availability in CWs rhizosphere. As IP has the potential to enhance pollutant removal by being regulated and managed, we summarized the critical factors affecting the IP formation from the perspective of wetland design and operation, as well as emphasizing the heterogeneity of rhizosphere redox and the role of key microbes in nutrient cycling. Subsequently, interactions between redox-controlled root IP and biogeochemical elements (C, N, P) are emphatically discussed. Additionally, the effects of IP on emerging contaminants and heavy metals in CWs rhizosphere are assessed. Finally, major challenges and outlooks for future research in regards to root IP are proposed. It is expected that this review can provide a new perspective for the efficient removal of target pollutants in CWs.","Fe redox cycling, Contaminant removal, N transformation, C turnover, P availability, Rhizosphere"
7,DIMARTINO20235650,"Di Martino, Alberto; Villari, Eleonora; Poluzzi, Riccardo; Brunello, Matteo; Rossomando, Valentino; D’Agostino, Claudio; Ruta, Federico; Faldini, Cesare",Role of biophysical stimulation in multimodal management of vertebral compression fractures,Computational and Structural Biotechnology Journal,21,,5650-5661,2023,,https://www.sciencedirect.com/science/article/pii/S2001037023004385,"Raised life expectancy and aging of the general population are associated with an increased concern for fragility fractures due to factors such as osteoporosis, reduced bone density, and an higher risk of falls. Among these, the most frequent are vertebral compression fractures (VCF), which can be clinically occult. Once the diagnosis is made, generally thorough antero-posterior and lateral views of the affected spine at the radiographs, a comprehensive workup to assess the presence of a metabolic bone disease or secondary causes of osteoporosis and bone frailty is required. Treatment uses a multimodal management consisting of a combination of brace, pain management, bone metabolism evaluation, osteoporosis medication and has recently incorporated biophysical stimulation, a noninvasive technique that uses induced electric stimulation to improve bone recovery through the direct and indirect upregulation of bone morphogenic proteins, stimulating bone formation and remodeling. It contributes to the effectiveness of the therapy, promoting accelerated healing, supporting the reduction of bed rest and pain medications, improving patients’ quality of life, and reducing the risk to undergo surgery in patients affected by VCFs. Therefore, the aim of this review is to outline the fundamental concepts of multimodal treatment for VCF, as well as the present function and significance of biophysical stimulation in the treatment of VCF patients.","Vertebral compression fractures, Fragility fractures, Biophysical stimulation, Capacitive-coupling"
