BibliographyType,ISBN,Identifier,Author,Title,Journal,Volume,Number,Month,Pages,Year,Address,Note,URL,Booktitle,Chapter,Edition,Series,Editor,Publisher,ReportType,Howpublished,Institution,Organizations,School,Annote,Custom1,Custom2,Custom3,Custom4,Custom5
7,"","CHEN2020103332","Chen, Jingwen; Zhao, Qi; Peng, Jianmin; Yang, Xin; Yu, Dongsheng; Zhao, Wei","Antibacterial and mechanical properties of reduced graphene-silver nanoparticle nanocomposite modified glass ionomer cements","Journal of Dentistry",96,,"","103332",2020,"","","https://www.sciencedirect.com/science/article/pii/S0300571220300713","","","","","","","","","","","","","Objectives Glass ionomer cements (GIC) are widely recognized as important dental restorative materials whilst they often suffer from restoration failures due to the poor mechanical properties and secondary caries. Reduced graphene-silver nanoparticle (R-GNs/Ag) nanocomposite exhibits excellent antibacterial activities. This study aimed to evaluate the antibacterial and mechanical properties of GIC modified by incorporation of different proportion of R-GNs/Ag. Methods R-GNs/Ag nanoparticles were incorporated into conventional glass ionomer powder at 0–2.00 wt.% concentration and cement specimen were prepared. The antibacterial properties of R-GNs/Ag modified GIC materials were investigated by direct contact test (DCT), scanning electron microscopy (SEM) observation, XTT assay and bacteria live/dead assay. Flexural strength and surface microhardness were measured by a universal testing machine and a microhardness tester, respectively. Results The DCT demonstrated an obvious decrease of S. mutans quantity with incorporation of 2.00 wt.% nanoparticles (p < 0.05). SEM images showed fewer bacteria and smaller stacks on the surface of modified specimens. No significant difference was found in the metabolic activity of S. mutans according to the XTT assay (p < 0.05). The addition of 1.00 and 2.00 wt.% R-GNs/Ag significantly decreased the percentage of viable bacteria (p < 0.05). There was no significant decrease of flexural strength and surface microhardness with incorporation of up to 2.00 wt.% nanocomposite (p < 0.05). Conclusions R-GNs/Ag nanocomposite might be a promising agent to improve the antibacterial activity of dental restorative GIC without compromising its mechanical properties. Clinical significance R-GNs/Ag nanocomposite can serve as a potential modifier for dental restorative materials.","","Glass ionomer cements, Reduced graphene, Silver nanoparticle, Nanocomposite, Antibacterial activity, Mechanical property","",""
7,"","WANG2023104411","Wang, Yichun; Ding, Yashuang; Deng, Jie; Nie, Rongrong; Meng, Xiangfeng","Antibacterial one-step self-etching dental adhesive with silver nanoparticles synthesized in situ","Journal of Dentistry",129,,"","104411",2023,"","","https://www.sciencedirect.com/science/article/pii/S0300571223000039","","","","","","","","","","","","","Objectives The objective of this study is to value the long-term antibacterial capability and adhesive properties of one-step self-etching dental adhesive containing silver nanoparticles (AgNPs) synthesized in situ. Methods One-step self-etching adhesives with various weight percentages of silver 2-ethylhezanoate (0%, 0.05%, 0.10%, and 0.20%) were obtained by in-situ synthesis; the sizes and distribution of the AgNPs in resin were observed. The antibacterial effects of dentin-resin specimens were assessed by various test methods after being aged for 1 week to 1 year. The microtensile bond strength (μTBS) and interfacial nanoleakage (NL) were evaluated using extracted human teeth after being aged for 1 day and 1 year. Results Uniform distribution of AgNPs in resin was observed in all experimental groups, and the average size was 4.71 nm-4.81 nm. All groups containing AgNPs showed significant antibacterial differences from the control group (P<0.05) over the ageing of 1 year. Although the increase of concentration tended to improve antibacterial activity, significant differences were not observed between the 0.10% and 0.20% groups (P>0.05). No significant differences were observed between all experimental groups and the control group in μTBS testing and NL testing at 1-day and 1-year time points (P>0.05). Conclusions 0.10% AgNPs synthesized in situ might be appropriate to impart a long-term antibacterial ability to the one-step self-etching adhesive, without affecting its adhesive performance. Clinical Significance This study suggests that in-situ synthesis of AgNPs is an effective method to improve the antibacterial ability of dental adhesives with the potential to inhibit secondary caries.","","Silver nanoparticles, In-situ synthesis, Self-etching adhesive, Antibacterial activity","",""
7,"","RICUCCI201941","Ricucci, Domenico; Siqueira, José F.; Li, Yuanyuan; Tay, Franklin R.","Vital pulp therapy: histopathology and histobacteriology-based guidelines to treat teeth with deep caries and pulp exposure","Journal of Dentistry",86,,"","41-52",2019,"","","https://www.sciencedirect.com/science/article/pii/S0300571219301058","","","","","","","","","","","","","Objectives Vital pulp therapy (VPT) encompasses distinct treatment modalities for deep caries that approximate the pulp chamber in vital teeth. Confusion exists in the literature in terms of the indication and rationale for each VPT approach. The objectives of the present study are to elucidate the indications for VPT and to present a set of histopathology and histobacteriology-based guidelines for VPT in teeth with deep caries. Methods Two hundred and sixty-four carious, unrestored and VPT-treated human teeth, which were extracted for reasons not related to the present study. The teeth were processed for histological and histobacteriological examination. Other 757 clinical cases that received different VPT procedures were followed-up to identify success rates, with the longest observational period of 30 years. Results Follow-up of the clinical cases indicated that direct pulp capping was successful in 73.2%, partial pulpotomy in 96.4% and full pulpotomy in 77.8% of the cases. Histological and histobacteriological examination showed a localised inflammatory response that commonly occurred in the subjacent pulp tissue as soon as the enamel was penetrated by caries. If the softened and infected dentine were completely excavated, without pulp exposure, and the cavity restored with an adequate restoration, pulp inflammation frequently subsided. In teeth showing pulp exposure, the extent of bacterial penetration varied and areas of infection presented severe pulp inflammation, including micro-abscesses. However, the pulp tissue apical to the infected/inflamed area was usually uninflamed and normal. Guidelines based on the present histopathological, histobacteriological and clinical findings are proposed for VPT and mainly involve direct examination of dentine and the exposed pulp tissue under deep caries for decision-making, and require strict asepsis during procedures. Conclusions Vital pulp therapy following the guidelines proposed in the present article has the potential to improve the outcome of the conservative treatment of mature teeth with deep caries and in some occasions may be an alternative to pulpectomy. Clinical Significance A guideline for VPT in the treatment of deep caries is proposed, focusing on direct observation of dentine and the exposed pulp tissue under deep caries. Stringent aseptic techniques are mandatory for VPT procedures to be successful.","","caries, direct pulp capping, pulpotomy, vital pulp therapy","",""
7,"","MATOS2019103219","Matos, Thalita P.; Gutiérrez, Mario F.; Hanzen, Taise A.; Malaquias, Pâmela; de Paula, Alexandra M.; de Souza, Jullian J.; Hass, Viviane; Fernández, Eduardo; Reis, Alessandra; Loguercio, Alessandro D.","18-month clinical evaluation of a copper-containing universal adhesive in non-carious cervical lesions: A double-blind, randomized controlled trial","Journal of Dentistry",90,,"","103219",2019,"","","https://www.sciencedirect.com/science/article/pii/S0300571219302222","","","","","","","","","","","","","Objective This study aimed to evaluate the addition of copper nanoparticles (CuNp) on the clinical performance of a universal adhesive system used as etch-and-rinse (ER) and self-etch (SE). Methods 216 restorations were randomly placed in 36 subjects according to the following groups: ERcu = etch-and-rinse with 0.1% CuNp; ERct = etch-and-rinse without CuNp; SEcu = self-etch with 0.1% CuNp; SEct = self-etch without CuNp. Resin composite was placed incrementally and light-cured. The restorations were evaluated at baseline and 6, 12 and 18 months using the FDI and USPHS criteria. Statistical analyses were performed using appropriate tests (α = 0.05). Results The addition of CuNp did not increase the clinical performance (FDI / USPHS) of the universal adhesive tested after 18-month when applied in the ER mode (p > 0.05). The addition of CuNp in SE restorations increased the retention rate significantly and decreased the marginal discrepancies after 18 months (p < 0.05). Conclusion The clinical performance of universal adhesive was significantly increased when applied in the SE mode with the addition of copper nanoparticles. Clinical relevance This is the first study that demonstrates a slight improvement in the clinical performance of universal adhesive systems in non-carious cervical lesions when added CuNp in lower concentration.","","Universal adhesive system, Copper nanoparticles, Non-carious cervical lesion, Clinical trial, Longevity","",""
7,"","CARDOSOSILVA2023104677","Cardoso-Silva, Lana; Vicioni-Marques, Fernanda; de Paula-Silva, Francisco Wanderley Garcia; de Freitas, Bruna Neves; Nelson-Filho, Paulo; Tirapelli, Camila; de Carvalho, Fabrício Kitazono","Comparison between intraoral scanning and direct visual analysis for the assessment of developmental defects of enamel","Journal of Dentistry",137,,"","104677",2023,"","","https://www.sciencedirect.com/science/article/pii/S0300571223002634","","","","","","","","","","","","","Objective To compare direct visual analysis (DVA) and intraoral scanning (IOS) for the assessment of developmental defects of the enamel (DDE). Methods Thirty-nine extracted permanent human teeth with DDE were selected by an experienced examiner and digitised using IOS. The scanning was recorded using the OBS Studio software parallel to the IOS software to obtain a coloured high-definition MP4 file of the process. Two other experienced, blinded, and calibrated examiners randomly analysed the same teeth through DVA and IOS. A third examiner resolved any disagreements between the two examiners. Descriptive statistics were used to analyse the frequencies of the scores. Cohen's kappa test was used to determine whether the DVA scores were different from those assigned using IOS. Spearman's test was used to verify non-random examiner errors. The Chi-square test was used to compare score frequencies. Statistical significance was set at p <0.05. Results Scores indicating more severe and extended DDE (p <0.05) were more frequently assigned with IOS than with DVA (IOS: 25.64%, 25.64%, 38.46%, and 35.90% between one-third to two-third of the lingual, occlusal, mesial, and distal surfaces, respectively; vs. DVA: 10.26%, 7.69%, 15.38%, and 10.26% for the respective aforementioned tooth surfaces). Contrarily, ‘no visible enamel defect’ was significantly less assigned for IOS than for DVA (IOS: 15.38%, 43.59%, 35.90%, 15.38%, and 17.95% for buccal, lingual, occlusal, mesial, and distal surfaces, respectively; vs. DVA: 38.46%, 66.67%, 56.41%, 51.28%, and 43.59% for the respective aforementioned tooth surfaces). Kappa agreement ranged from fair to moderate when comparing DVA and IOS; the correlation between both methods was positive, indicating that the examiners assigned the scores properly and the differences arose from employing different methods. Conclusion The assessment of DDE differed depending on the method used. IOS scores indicated more severe and extended DDE than DVA scores. Clinical investigation is the next step in validating the use of IOS for DDE diagnosis. Clinical Significance This study showed that DDE can be assessed differently using IOS. It is clinically relevant as it directly affects the determination of the severity of the defect and dental treatment planning.","","Enamel hypomineralisation, Diagnosis, Intraoral scanner, Diagnostic imaging, Three-dimensional imaging","",""
7,"","YANG2019103213","Yang, Vincent; Fried, Daniel","Measurement of the shrinkage of natural and simulated lesions on root surfaces using CP-OCT","Journal of Dentistry",90,,"","103213",2019,"","","https://www.sciencedirect.com/science/article/pii/S0300571219302143","","","","","","","","","","","","","Objectives Demineralized root dentin and cementum is made up of mostly collagen that shrinks significantly upon dehydration or drying with air. During remineralization mineral is deposited on the outside of the lesion creating a highly mineralized surface layer that inhibits diffusion, arrests the lesion and prevents shrinkage. Previous studies suggest that active root caries lesions manifest shrinkage, while arrested lesions no longer manifest shrinkage upon dehydration. The purpose of this study was to demonstrate that the shrinkage of root caries lesions can be monitored during dehydration using an optical coherence tomography probe suitable for clinical use. Methods In this in vitro study the shrinkage of simulated and natural root caries lesions on extracted teeth was measured using a cross polarization optical coherence tomography (CP-OCT) system and a 3D printed appliance with an integrated air nozzle suitable for clinical use. Two methods were employed to assess shrinkage, changes in the position of the lesion surface and changes in the thickness of the lesion. Results CP-OCT was successful in measuring a significant (P < 0.05) contraction of the lesion surface, significant decrease in the lesion thickness and increase in the reflectivity per micron upon drying natural lesions on extracted teeth. Conclusions In this preclinical study, we have demonstrated that a CP-OCT handpiece modified for infection control with an attached air nozzle suitable for in vivo use can be used to monitor the shrinkage of root caries lesions. In addition, we have developed a new approach to measuring lesion shrinkage with OCT, namely monitoring changes in the lesion thickness as opposed to the position of the lesion surface, that does not require an initial reference position and is more easily implemented in vivo.","","Optical coherence tomography, Root caries, Shrinkage, Lesion activity","",""
7,"","SHERIGAR2023104592","Sherigar, Shwetha R.; Feine, Jocelyne S.; Cooper, Lyndon F.; Stanford, Clark M.; Barwacz, Christopher A.; McGuire, Michael; Abi Nader, Samer; de Souza, Raphael F.","Can patients detect peri‑implant mucosal inflammation? Results from a multicentre randomized trial","Journal of Dentistry",135,,"","104592",2023,"","","https://www.sciencedirect.com/science/article/pii/S0300571223001781","","","","","","","","","","","","","Purpose The objective of this study was to compare patient-reported outcomes (PROs) of peri‑implant soft tissue inflammation and aesthetics around single-tooth implants in the anterior maxillary region with three different implant-abutment interface designs. Methods Participants were randomized to one of three different types of implant-abutment interface designs [Conical (CI), flat-to-flat (FI), and Platform Switched (PS)]. Implants and provisional crowns with prefabricated titanium abutments were placed 5 months following extraction and/or ridge augmentation. Permanent ceramic crowns with zirconia abutments were placed after 12 weeks. To assess PROs, appearance and inflammation questionnaires were completed from provisional crown placement to the 3-year follow-up. Results Tooth appearance at the 3-year follow-up revealed a difference amongst CI, FI and PS implants (p=0.049; Kruskal-Wallis test). PS was rated better than FI (p=0.047) at 1 year for appearance of soft-tissue and satisfaction with colour. There were no differences for self-consciousness, smile and pain/discomfort while eating/hard food items. Conclusions Although participants tended to rate the health of mucosa around PS implants as slighty better than the other two implant systems, the differences were minimal and inconsistent. Thus, patient satisfaction in terms self-perceived gingival health and esthetics was high for all 3 systems tested, suggesting that patients are unable to detect mucosal inflammation. Clinical Significance Patients find it difficult to perceive mucosal inflammation; hence, it is recommended that patients attend implant follow-up visits, even if they do not perceive inflammation. The study suggests that there is a relationship between the PROs and the clinical outcomes of tested implants.","","Implant-abutment interface, Esthetics, Patient-reported outcomes, Peri-implant mucosa","",""
7,"","TORRES2023104466","Torres, A.; Dierickx, M.; Coucke, W.; Pedano, M. S.; Lambrechts, P.; Jacobs, R.","In vitro study on the accuracy of sleeveless guided endodontics and treatment of a complex upper lateral incisor","Journal of Dentistry",131,,"","104466",2023,"","","https://www.sciencedirect.com/science/article/pii/S0300571223000532","","","","","","","","","","","","","Purpose The present study aims to assess the accuracy of sleeveless guided endodontics for root canal treatment of severe pulp canal obliteration (PCO) in 3D printed jaws. Additionally, the treatment of a complex lateral incisor is presented to illustrate the use of sleeveless guides in a clinical situation. Methods Two cone-beam computed tomography (CBCT) volumes of an upper and lower jaw were selected to design 3D printed models with PCO. Virtual planning of the access cavities was performed from right to left second premolar. Then, the models were mounted into a phantom head to simulate an actual patient. Two operators with different levels of experience in endodontics performed guided access cavities. The handpiece was guided by guiding rails placed against each other on the sides of the tooth. A post-operative CBCT scan was taken for analysis. Results Eighty-eight guided access cavities (44 per operator) were drilled on eight 3D printed models. The mean length of the access cavities was 15.3 mm, with a mean coronal and apical deviation of 0.5 mm and 0.7 mm respectively. The mean angular deviation was 1.5°. No statistically significant difference was found between operators for the three measured parameters. Conclusions This study demonstrates, within its limitations, that sleveless guides represent an accurate method for guided endodontic treatment. No statistically significant difference between operators was found when using the guide. Clinical significance This method offers a valuable alternative to conventional endodontic guides with similar accuracy results.","","3-Dimensional printing, Accuracy, Cone beam computed tomography, Dental pulp calcification, Guided endodontics","",""
7,"","HU2023104552","Hu, Jinghao; Yu, Jian; Liu, He; Wang, Zhejun; Haapasalo, Markus; Haney, Evan F.; Hancock, Robert E. W.; Deng, Shuli; Shen, Ya","Dynamic killing effectiveness of mouthrinses and a d-enantiomeric peptide on oral multispecies biofilms grown on dental restorative material surfaces","Journal of Dentistry",134,,"","104552",2023,"","","https://www.sciencedirect.com/science/article/pii/S0300571223001380","","","","","","","","","","","","","Objective To evaluate the dynamics of killing of oral multispecies biofilms grown on dental restorative materials by commercially available mouthrinses and a d-enantiomeric peptide. Methods Four composite resins (3 M Supreme, 3 M Supreme flow, Kerr Sonicfill, and Shofu Beautifil II) and one glass ionomer (GC Fuji II) were used as restorative materials. Plaque biofilms were grown on the surfaces of restorative material discs for 1 week. The surface roughness and biofilm attachment were assessed by atomic force microscopy and scanning electron microscopy. One-week-old biofilms grown anaerobically at 37 °C were exposed to each of five solutions for one minute (twice daily for seven days): Listerine Total care and Paroex Gum mouthrinses, 0.12% chlorhexidine, 0.001% d-enantiomeric peptide DJK-5, and sterile water. The dynamic variation of the biovolume of the biofilms and the percentage of dead bacteria were monitored and analyzed using confocal laser scanning microscopy. Results All restorative materials had similar surface roughness with intact biofilm attachment. The percentage of dead bacteria and biovolume of biofilms treated by each oral rinse solution remained constant between days 1 and 7, with no statistically significant difference. DJK-5 showed the highest percentage of dead bacteria (up to 75.7%; cf. ∼20–40% for other mouthrinses) of all solutions tested within 7 days. Conclusions DJK-5 outperformed conventional mouthrinses in killing bacteria in oral multispecies biofilms grown on dental restorative materials. Clinical significance The antimicrobial peptide DJK-5 is effective against oral biofilms and serves as a promising candidate for the development of future mouthrinses to improve long-term oral hygiene.","","Biofilm, Composite, Mouthrinse, Peptide, Surface roughness","",""
7,"","LEE2022103892","Lee, Joo-Young; Jung, Hoi-In; Kim, Baek-Il","A novel model to predict tooth bleaching efficacy using autofluorescence of the tooth","Journal of Dentistry",116,,"","103892",2022,"","","https://www.sciencedirect.com/science/article/pii/S0300571221003146","","","","","","","","","","","","","Objectives We aimed to confirm whether autofluorescence emitted from teeth can predict tooth bleaching efficacy and establish a novel model combining natural color parameters and tooth autofluorescence data to improve the predictability of tooth bleaching. Methods A total of 61 tooth specimens were prepared from extracted human molars/premolars and immersed in 35% hydrogen peroxide for 1 h for tooth bleaching. The changes in laser-induced fluorescence (∆LIF) were assessed using Raman spectrometry. Tooth color and autofluorescence data were obtained using quantitative light-induced fluorescence (QLF) technology. Pearson correlation analyses were used to confirm the relationship between ∆LIF and autofluorescence. Intraclass correlation coefficients (ICC) were calculated to compare the conventional and new prediction models. Decision tree analysis was performed to evaluate clinical applicability. Results The yellowness-to-blueness value from fluorescence imaging showed a moderate correlation with ∆LIF (r= –0.409, p = 0.001). The degree of agreement between the actual efficacy and that predicted by our novel model was high (ICC=0.933, p = 0.002). Decision tree analysis suggested that tooth autofluorescence could be a key factor in prediction of tooth bleaching outcomes. Conclusions Our findings showed that autofluorescence detected from QLF images may be used to predict tooth bleaching efficacy. Our proposed model appeared to improve the predictability of tooth bleaching.","","Tooth bleaching, Prediction, Autofluorescence, Quantitative light-induced fluorescence (QLF) technology, Raman spectrometry","",""
7,"","ZARONE2021103661","Zarone, Fernando; Ruggiero, Gennaro; Leone, Renato; Breschi, Lorenzo; Leuci, Stefania; Sorrentino, Roberto","Zirconia-reinforced lithium silicate (ZLS) mechanical and biological properties: A literature review","Journal of Dentistry",109,,"","103661",2021,"","","https://www.sciencedirect.com/science/article/pii/S0300571221000828","","","","","","","","","","","","","Objectives This paper aimed to provide a literature review of the mechanical and biological properties of zirconia-reinforced lithium silicate glass-ceramics (ZLS) in Computer-aided design / Computer-aided manufacturing (CAD/CAM) systems. Data/Sources An extensive search of the literature for papers related to ZLS was made on the databases of PubMed/Medline, Scopus, Embase, Google Scholar, Dynamed, and Open Grey. The papers were selected by 3 independent calibrated reviewers. Study selection The search strategy produced 937 records. After the removal of duplicates and the exclusion of papers that did not meet the inclusion criteria, 71 papers were included. Conclusions After reviewing the included records, it was found that two types of ZLS (Vita Suprinity PC; Vita Zahnfabrik and Celtra Duo; Dentsply Sirona) are nowadays available on the market for CAD/CAM systems, similar in their chemical composition, microstructure, and biological-mechanical properties. ZLS is reported to be a biocompatible material, whose fracture resistance can withstand physiological chewing loads. The firing process influences the improvements of strength and fatigue failure load, with a volumetric shrinkage. To date, ZLS can be considered a viable alternative to other glass-ceramics for fixed single restorations. Clinical Significance . As to biocompatibility and mechanical properties of ZLS, data are still scarce, often controversial and limited to short-term observational periods. These promising ceramics require further in vitro/in vivo studies to accurately define mechanical and biological properties, mainly in the long-term performance of restorations produced with such materials.","","ZLS, Zirconia-reinforced lithium silicate, Dental materials, Ceramics, Zirconia, CAD-CAM","",""
