BibliographyType,ISBN,Identifier,Author,Title,Journal,Volume,Number,Month,Pages,Year,Address,Note,URL,Booktitle,Chapter,Edition,Series,Editor,Publisher,ReportType,Howpublished,Institution,Organizations,School,Annote,Custom1,Custom2,Custom3,Custom4,Custom5
7,"","ALSAHAFI2022104140","AlSahafi, Rashed; Mitwalli, Heba; Alhussein, Abdullah; Melo, Mary Anne S.; Martinho, Frederico; Lynch, Christopher D.; Oates, Thomas W.; Xu, Hockin H. K.; Weir, Michael D.","Novel rechargeable nanostructured calcium phosphate crown cement with long-term ion release and antibacterial activity to suppress saliva microcosm biofilms","Journal of Dentistry",122,,"","104140",2022,"","","https://www.sciencedirect.com/science/article/pii/S0300571222001968","","","","","","","","","","","","","Objective Resin cements with remineralizing and antibacterial properties are favorable for inhibition of caries. The objectives of this study were: (1) to investigate the capability of the novel dimethylaminohexadecyl-methacrylate (DMAHDM) and nano-sized amorphous calcium phosphate (NACP) containing cement to reduce saliva microcosm biofilm, and (2) to investigate the long-term ion release, recharge, and re-release of DMAHDM-NACP cement. Methods Pyromellitic glycerol dimethacrylate (PMGDM) and ethoxylated bisphenol-A-dimethacrylate (EBPADMA) were used to make PEHB monomer. Five cements were fabricated: (1) PEHB+0%NACP+0%DMAHDM (experimental control); (2) PEHB+25%NACP+0%DMAHDM, (3) PEHB+25%NACP+0%DMAHDM; (4) PEHB+25%NACP+3%DMAHDM; (5) PEHB+25%NACP+5%DMAHDM. RelyX luting cement was used as commercial control. Colony-forming units (CFU), lactic acid production, metabolic activities, and minimum inhibitory concentration (MIC) were performed. Long-term Calcium (Ca) and phosphate (P) ion release, recharge, and re-release were assessed. Results Compared to experimental and commercial controls, the NACP-DMAHDM cement significantly reduced CFU biofilm by 2–3 orders of magnitude, metabolic activities from 0.24±0.06 A540/cm2 to 0.03±0.01 A540/cm2, and lactic acid production from 27.7 ± 2.5 mmol/L to 5.4 ± 2.1 mmol/L (n = 6) (p<0.05). The DMAHDM showed an MIC value of 0.03 mg/L. However, when the DMAHDM was combined with PMGDM monomer, the MIC was greater than DMAHDM alone. The ion concentrations for the experimental groups significantly increased over time (1–84 days), indicating continuous ion release (n = 3) (p<0.05). Increasing the DMAHDM mass fraction from 0% to 5% and 3% to 5% significantly enhanced ion recharge and re-release at the third cycle (p<0.05). Conclusions Incorporating DMAHDM and NACP into resin-based crown cement provides strong antibacterial action against saliva microcosm biofilm and presents a high level of Ca and P ion recharge abilities, exhibiting long-term Ca and P ion release and remineralization potential. Clinical Significance Resin based cement containing NACP and DMAHDM were developed with remineralizing and potent antibacterial effects. This cement formulation showed ion release and remineralization potential and are promising formulations to inhibit the incidence of recurrent caries and could promote remineralization and be sustainable for the long term.","","Dental cement, Antibacterial, Antibiofilm, Remineralizing, Bio-interactive, Calcium phosphate nanoparticles","",""
7,"","MARTIN2021103737","Martin, Nicolas; Sheppard, Madison; Gorasia, GaneshParth; Arora, Pranav; Cooper, Matthew; Mulligan, Steven","Drivers, opportunities and best practice for sustainability in dentistry: A scoping review","Journal of Dentistry",112,,"","103737",2021,"","","https://www.sciencedirect.com/science/article/pii/S0300571221001585","","","","","","","","","","","","","Objective To undertake a comprehensive scoping review of the literature to address the research question ‘What is the current state of environmental sustainability in general dental practice?’ To provide an effective baseline of data that will consider the drivers, opportunities and recommendations for the implementation of sustainable practice. Data & sources The scoping review was conducted for all published literature in the English language that addresses this topic up to the 31st April 2021. The method of the PRISMA-ScR (PRISMA extension for Scoping Reviews was followed. 128 papers included in this scoping review consisted of: Commentary [Letters, editorials, communication and opinion] (n=39); Research (n=60); Literature reviews (n=25); Reports [Policy and legislation] (n=4). Each included record was analysed for emerging themes that were further classified according to their general relevance. The scoping review is considered over two manuscripts, with this second paper focusing on the opportunities, recommendations and best practice to develop and engage with sustainable practice. Conclusions Drivers, opportunities and recommendations for best practice to achieve environmentally sustainable goals in oral health care: The lack of public and professional awareness is the greatest driver to engage with a positive change of behaviour and attitudes. Awareness through education is key at all levels and this should be the bedrock of future strategies. Reduction in staff and patient commuter travel through a reduction of the incidence of preventable oral diseases, improved patient care logistics and IT. Reducing waste and increase recycling opportunities, especially for SUPs. Engagement with legislation and policy makers. Engagement with key stakeholders across the dental materials/products supply chain for the management of manufacturing, distribution, procurement, clinical use and waste management.","","Sustainability, Dentistry, Drivers, Opportunities, Best practice, Scoping review","",""
7,"","KALAYKOVA2019103159","Kalaykova, Stanimira I.; Sterenborg, Bernadette A. M. M.; Loomans, Bas A. C.; Huysmans, Marie-Charlotte D. N. J. M.","Impact of restorative treatment of tooth wear upon masticatory performance","Journal of Dentistry",88,,"","103159",2019,"","","https://www.sciencedirect.com/science/article/pii/S0300571219301307","","","","","","","","","","","","","Objective The restorative treatment of generalized tooth wear involves an increase in vertical dimension of occlusion and a comprehensive alteration of occlusal morphology. The aim of this study was to assess the impact of a direct adhesive restorative treatment on masticatory performance parameters. Materials and methods A sample of 23 fully dentate adult generalized tooth wear patients (17 male, 6 female, age 41.7 ± 8.3 years) undergoing direct composite restorative treatment was selected. Before and one month after restorative treatment with resin bonded composite restorations, masticatory performance was evaluated using 1) a comminution test, 2) a maximum voluntary bite force recording and 3) the sum score of five items related to eating and chewing from the Oral Health Impact Profile (OHIP-49) questionnaire. Statistical analysis was performed using a paired t-test, and analysis per OHIP item was done by a McNemar test (p < 0.05). Results There was no statistically significant difference in median particle size (X50) calculated before and after treatment (4.19 ± 0.97 and 4.03 ± 0.76, respectively, p = 0.327). Maximum voluntary bite force decreased significantly after treatment (baseline 389 ± 90 N, one month recall 323 ± 173 N, p = 0.028). The sum score of the five OHIP items significantly decreased after treatment (baseline 10.6 ± 4.8, one month recall 6.6 ± 2.5, p = 0.001), with the item regarding unsatisfactory diet showing the largest significance (p = 0.029). Conclusions This study indicates that the restorative treatment of generalized tooth wear using direct resin bonded composite has no significant short-term effect on masticatory performance as measured with a comminution test, although the self-reported ability to eat and chew, as measured by the sum score of all pertaining OHIP items, did significantly improve. Clinical significance On individual level, food comminution could be influenced by restorative treatment with increase of vertical dimension of occlusion, but at group level no significant effect is observed. Nevertheless, tooth wear patients do perceive improved ability to eat and chew foods, which is clinically relevant.","","Tooth wear, Restorative treatment, Vertical dimension of occlusion, Mastication, Chewing efficiency, Food comminution","",""
7,"","LI2023104678","Li, Yiling; Li, Bolei; Guo, Xiao; Wang, Haohao; Cheng, Lei","Applications of quaternary ammonium compounds in the prevention and treatment of oral diseases: State-of-the-art and future directions","Journal of Dentistry",137,,"","104678",2023,"","","https://www.sciencedirect.com/science/article/pii/S0300571223002646","","","","","","","","","","","","","Objectives The aim of this review is to comprehensively summarize the state-of-the-art developments of quaternary ammonium compounds (QACs) in the prevention and treatment of oral diseases. By discussing the structural diversity and the potential killing mechanism, we try to offer some insights for the future research of QACs. Data, sources & study selection A literature search was conducted in electronic databases (Web of Science, PubMed, Medline, and Scopus). Publications that involved the applications of QACs, especially those related to the prevention and treatment of oral diseases, are included. Results We have reviewed the relevant research on QACs over the past two decades. The research results indicate that the current applications are mainly focused on dental material modification and direct pharmacological interventions. Concurrently, challenges such as potential risks to normal tissues and impediments in drug resistance and microbial persistence present certain application constraints. The latest studies have encompassed the exploration of smart materials and nanoparticle formulations. Conclusions The killing mechanism may possess a threshold related to charge density. However, the exact process remains enigmatic. The structural diversity and the exploration of intelligent materials and nanoparticle formulations provide directions in development of novel QACs. Clinical significance The intricate oral anatomy, combined with the multifaceted oral microbiome, necessitates specialized materials for the targeted prevention and treatment of oral pathologies. QACs represent a cohort of compounds distinguished by potent anti-infective and anti-tumor attributes. Innovations in intelligent materials and nanoparticle formulations amplify their potential in significantly advancing the prevention and therapeutic interventions for oral diseases.","","Quaternary ammonium compounds, Oral diseases, Smart materials, Nanoparticles","",""
7,"","COMBA201925","Comba, Allegra; Maravic, Tatjana; Valente, Lucrezia; Girlando, Margherita; Cunha, Sandra R.; Checchi, Vittorio; Salgarello, Stefano; Tay, Franklin R.; Scotti, Nicola; Breschi, Lorenzo; Mazzoni, Annalisa","Effect of benzalkonium chloride on dentin bond strength and endogenous enzymatic activity","Journal of Dentistry",85,,"","25-32",2019,"","","https://www.sciencedirect.com/science/article/pii/S0300571219300697","","","","","","","","","","","","","Objective: This in vitro study evaluated at baseline (T0) and over time (T12 months), the effect of a multi-mode universal adhesive compared with two experimental formulations blended with different concentrations of benzalkonium chloride (BAC), on bond strength and endogenous enzymatic activity. Methods and materials: Specimens were assigned to the following groups according to the adhesive protocol: G1) All-Bond Universal (ABU) self-etch (SE); G2) ABU + 0.5% BAC SE; G3) ABU + 1% methacrylate BAC SE; G4) ABU etch-and-rinse (E&R); G5) ABU + 0.5% BAC E&R; G6) ABU + 1% methacrylate BAC E&R. Gelatin zymography was performed on dentin powder obtained from eight human third molars. Endogenous enzymatic activity within the hybrid layer was examined using in situ zymography after 24 h (T0) or 1-year storage in artificial saliva (T12). Forty intact molars were prepared for microtensile bond strength test at T0 and T12. Results were statistically analyzed with three-way ANOVA (α = 0.05). Results: Gelatin zymography assay and in situ zymography quantification analyses indicated that all the BAC-containing formulations decreased matrix metalloproteinase expression. However, in situ zymography showed a general trend of enzymatic activity increase after aging. Microtensile bond-strength testing showed decrease in bond strength over time in all the tested groups; performances of the 1% methacrylate BAC experimental groups were worse than the control. Conclusions: BAC-containing adhesives reduce endogenous enzymatic activity both immediately and over time. However, independently from the adhesive employed, increase in the gelatinolytic activity over time and decrease in bond strength was found (especially in the BAC + 1% methacrylate groups), probably due to impaired polymerization properties. Clinical significance: Adhesives containing protease inhibitors are practical and efficient tools in clinical practice for enhancement of the longevity of dental restorations. However, extensive investigation of the mechanical and adhesive properties of the material is necessary prior to their clinical use.","","Benzalkonium chloride, Universal adhesives, MMPs, In situ zymography, Zymographic assay, Microtensile bond strength","",""
7,"","YU2021103529","Yu, Zhaohan; Tao, Siying; Xu, Hockin H. K.; Weir, Michael D.; Fan, Menglin; Liu, Yifang; Zhou, Xuedong; Liang, Kunneng; Li, Jiyao","Rechargeable adhesive with calcium phosphate nanoparticles inhibited long-term dentin demineralization in a biofilm-challenged environment","Journal of Dentistry",104,,"","103529",2021,"","","https://www.sciencedirect.com/science/article/pii/S0300571220302761","","","","","","","","","","","","","Objectives This study aims to investigate the long-term demineralization-inhibition capability of a rechargeable adhesive with nanoparticles of amorphous calcium phosphate (NACP) on dentin in a biofilm-challenged environment. Methods The NACP adhesive was immersed in a pH 4 solution to exhaust calcium (Ca) and phosphate (P) ions and then recharged with Ca and P ions. Dentin samples were demineralized underStreptococcus mutans biofilms for 24 h and randomly divided into two groups: (1) dentin control, (2) dentin with recharged NACP adhesives. Each day, all the samples were immersed in brain heart infusion broth with 1% sucrose (BHIS) for 4 h, and then in artificial saliva (AS) for 20 h. This cycle was repeated for 10 days. The pH of BHIS, the Ca and P ions content of the BHIS and AS were measured daily. After 10 days, the lactic acid production and colony-forming units of the biofilms were tested. The changes of remineralization/demineralization were also analyzed. Results Dentin in the control group showed further demineralization. The recharged NACP adhesive neutralized acids, increasing the pH to above 5, and released large amounts of Ca and P ions each day. The recharged NACP adhesive decreased the production of lactic acid (P < 0.05), inhibited dentin demineralization and sustained the dentin hardness in the biofilm-challenged environment, showing an excellent long-term demineralization-inhibition capability. Conclusions The NACP adhesive could continuously inhibit dentin demineralization in a biofilm-challenged environment by recharging with Ca and P ions. Significance The rechargeable NACP adhesive could provide long-term dentin bond protection.","","Calcium phosphate nanoparticles, TMR, Dental adhesive, Caries inhibition, Rechargeable, Biofilm-challenged environment","",""
7,"","ZAIN2020103389","Zain, Syed; Davis, Graham R.; Hill, Robert; Anderson, Paul; Baysan, Aylin","Mineral exchange within restorative materials following incomplete carious lesion removal using 3D non-destructive XMT subtraction methodology","Journal of Dentistry",99,,"","103389",2020,"","","https://www.sciencedirect.com/science/article/pii/S0300571220301354","","","","","","","","","","","","","Objectives The objective of this study was to quantify the changes in mineral and selected element concentrations within residual carious dentine and restorative materials following incomplete carious lesion removal (ICLR) using different cavity liners, with non-destructive subtraction 3D-X-ray Microtomography (XMT, QMUL, London, UK). Materials and methods A total of 126 extracted teeth with deep dental caries were assessed using International Caries Risk and Assessment (ICDAS). Eight teeth were subsequently selected after radiographic evaluation. Each lesion was removed, leaving a thin layer of leathery dentine at the deepest part of cavity. Different cavity lining materials were placed; Mineral Trioxide Aggregate (MTA), calcium hydroxide, (Ca(OH)2), resin-based material (RBM). For each, the restorative material was an encapsulated glass ionomer (GIC) and the control group had a GIC restoration alone. Each tooth was immediately placed in Simulated Body Fluid (SBF). All samples were then imaged using XMT at baseline, and three weeks after treament. The XMT images were then subtracted to show the mineral concentration changes three weeks after treatment. Results There were significant increases in mineral concentrations within the residual demineralised dentine in individual teeth treated with Ca(OH)2, MTA, RBM, and GIC following immersion in SBF for three weeks. GIC group without any liners showed the greatest increase in mineral concentration, followed by MTA and Ca(OH)2. Conclusion Mineral changes in demineralised dentine and within restorative materials are quantifiable using non-destructive 3D-XMT subtraction methodology. This laboratory study suggested that calcium, phosphate and strontium ion-exchange occurs with GIC, MTA and Ca(OH)2 in deep dentinal lesions following ICLR. Clinical relevance In clinical practice, incomplete carious lesion removal could be performed to avoid the dental pulp exposure. 3D non-destructive XMT subtraction methodology in a laboratory setting is advantageous to provide evidence for different restorative materials on deep carious lesions prior to clinical investigations.","","Dental caries, Calcium hydroxide, MTA, GIC, Resin-based material, XMT","",""
7,"","ILIE2021103568","Ilie, Nicoleta; Schmalz, Gottfried; Fujioka-Kobayashi, Masako; Lussi, Adrian; Price, Richard Bengt","Correlation of the mechanical and biological response in light-cured RBCs to receiving a range of radiant exposures: Effect of violet light","Journal of Dentistry",105,,"","103568",2021,"","","https://www.sciencedirect.com/science/article/pii/S030057122030316X","","","","","","","","","","","","","Objective This study correlates the mechanical and biological response of commercially available resin-based composites (RBCs) to clinically relevant light-curing conditions. Methods Two RBCs (Venus and Venus Pearl; Kulzer) that use different monomer and photo-initiator systems, but have a similar filler volume and shade, were exposed to either just blue light, or violet and blue light from two different LCUs (Translux Wave and Translux 2Wave; Kulzer). Distance and exposure times were adjusted so that both LCUs delivered 5 similar levels of radiant exposures (RE) between 1.5 J/cm²–25 J/cm² in the blue wavelength range. Thus, the violet light was additional light. The top and bottom of 2-mm thick specimens were subjected to a depth-sensing indentation test (Martens hardness/HM, Vickers hardness/HV, indentation modulus/YHU, mechanical work/Wtotal, plastic deformation work/Wplas, creep/Cr). The viability of human gingival fibroblasts was assessed after three days of exposure to RBC eluates. One and multiple-way analysis of variance (ANOVA), the Tukey honestly significant difference (HSD) post-hoc tests (α = 0.05), t-test and a Spearman correlation analysis were used. Results As the RE increased, the mechanical properties increased at a greater rate at the top compared to the bottom of the RBCs. Values measured at the bottom of 2-mm increments approached the values measured at the top only when RE > 25 J/cm² of blue light was delivered. Toxicity decreased with RE and elution cycles and was lower for Venus Pearl. Within one RE level, addition of violet light resulted in significantly improved properties (in 131 out of 150 comparisons, p < 0.05). This effect was stronger for Venus Pearl. There was a good correlation between mechanical and biological parameters. This correlation decreased as the number of eluates increased. Clinical significance The mechanical and biological response to variation in RE is interrelated. The addition of violet light has a positive effect, particularly at low RE.","","Light curing units, Resin-based composite, Hardness, Indentation modulus, Cell viability","",""
7,"","TREBING2020103458","Trebing, Charlotte Theresa; Schwindling, Franz Sebastian; Leisner, Laura; Trebing, Johannes; Lux, Christopher J.; Rammelsberg, Peter; Sen, Sinan","Diagnostic accuracy of 870-nm spectral-domain OCT with enhanced depth imaging for the detection of caries beneath ceramics","Journal of Dentistry",102,,"","103458",2020,"","","https://www.sciencedirect.com/science/article/pii/S0300571220302049","","","","","","","","","","","","","Objectives To evaluate the diagnostic accuracy of optical coherence tomography (OCT) for the non-invasive detection of caries adjacent to ceramic materials. Methods Disks made from five ceramic materials (hybrid ceramic, feldspathic ceramic, zirconia-reinforced lithium silicate, lithium disilicate, and high-translucent zirconia) were ground to the recommended material thickness for single crown restorations and laminated with a 100 μm thick layer of one of three adhesive cements. The disks were fixed to extracted human molars with or without carious lesions of one of three standardized sizes. A total of 240 stacks of cross-sectional scans obtained using an 870-nm SD-OCT with enhanced depth imaging (EDI) were presented to five raters. Diagnostic accuracy was determined by rating the teeth beneath the cemented material as carious or healthy. Results Carious samples were distinguished from sound teeth with high diagnostic accuracy, even for early stage caries. Sensitivity (SE) and specificity (SP) pooled over all raters and all materials were 0.9 and 0.97, respectively. When analyzing the effect of the ceramic and cement materials on detection rates, high SE and SP values of >0.96 and >0.91, respectively, were recorded for lithium disilicate, zirconia-reinforced lithium silicate, and high-translucent zirconia irrespective of the cement type. For hybrid and feldspathic ceramics, the cement material was found to have a significant effect on caries detection. Conclusions Given its high diagnostic accuracy, 870-nm SD-OCT with EDI might be useful for the detection of caries beneath restorative materials. The effect of the prescribed ceramic and cement material on optical penetration depth is substantial.","","Caries, Ceramic restorations, Optical coherence tomography, Diagnostic accuracy, Demineralization","",""
7,"","HU2022104071","Hu, Hongying; Burrow, Michael Francis; Leung, Wai Keung","Evaluation of 12-hour in situ bacterial colonization on smooth restorative material surfaces","Journal of Dentistry",119,,"","104071",2022,"","","https://www.sciencedirect.com/science/article/pii/S0300571222001282","","","","","","","","","","","","","Objectives The aim of this study was to investigate 12 h in situ bacterial colonization on different restorative materials with smooth surfaces. Methods The restorative materials examined included resin composite (RC), a glass ionomer cement (GIC), casein phosphopeptide-amorphous calcium phosphate modified GIC (CPP-ACP GIC, 3% w/w), and control bovine teeth. Polished bovine tooth and material slabs (average roughness < 0.2 μm) were prepared. Specimens were mounted in a custom-made removable appliance, then placed for 12 h in the oral cavities of ten systemically and orally healthy volunteers (23-30 year-old). The colonized bacteria on the restorative materials were evaluated by real-time quantitative polymerase chain reaction (q-PCR) and 16S rRNA gene sequencing. Results The in situ bacterial colonization, in terms of both total bacterial biomass and bacterial community composition, was similar among the restorative materials tested. The microbiota of early plaque comprised similar “core microbiota”, which were dominated by species within the genera of Streptococcus, Haemophilus, Neisseria, Gemella, and Prevotella, regardless of the type of underlying surface. Beta-diversity analyses revealed that most differences in the microbiota profile among samples were attributed to inter-individual variation, rather than the different materials. The microbial community composition of 12 h in situ plaque appeared different from that of whole saliva. Conclusions Similar bacterial composition of 12-h in situ plaque was observed on smooth material and tooth surfaces tested, including species mainly from within the Streptococcus, Haemophilus, Neisseria, Gemella, or Prevotella genera. Clinical significance The high inter-individual variation in plaque microbiota observed in this study, which outweighed the potential differences among various materials, demonstrated the importance of an in situ biofilm model as well as consideration of the host oral an microbial backgrounds when evaluating the bacterial colonization on restorative materials.","","Bacterial adhesion, Dental materials, , Oral microbiome, 16S rRNA gene sequencing","",""
