BibliographyType,ISBN,Identifier,Author,Title,Journal,Volume,Number,Month,Pages,Year,Address,Note,URL,Booktitle,Chapter,Edition,Series,Editor,Publisher,ReportType,Howpublished,Institution,Organizations,School,Annote,Custom1,Custom2,Custom3,Custom4,Custom5
7,"","RUTKUNAS2022104267","Rutkunas, V.; Bilius, V.; Simonaitis, T.; Auskalnis, L.; Jurgilevicius, J.; Akulauskas, M.","The effect of different implant impression splinting techniques and time on the dimensional accuracy: An in vitro study","Journal of Dentistry",126,,"","104267",2022,"","","https://www.sciencedirect.com/science/article/pii/S0300571222003232","","","","","","","","","","","","","Background: Splinting of impression copings is generally recommended for complex implant-supported restorations. It can also be used in the digital workflow when a control model is needed to improve the fit of the prosthesis. However, there is a lack of knowledge on how dimensional accuracy is affected by different splinting techniques and time factors. Objectives To evaluate the time factor on the dimensional stability of different implant impression splinting techniques used in the conventional and digital workflow. Materials and methods Ten pairs of implant analogs were fixed to a stainless steel bar. Modified impression copings were connected to the analogs and eight splinting strategies evaluated (n=10): (1) type I impression plaster (PLA), (2) autopolymerizing acrylic resin, cut and rejoin technique (PTR), (3) light-cured acrylic resin, cut and rejoin technique (ILC), (4) light-cured acrylic resin, no cutting and rejoining (ILN), (5) VPS bite registration material (SBR), (6) bis-acryl bite registration material (LXB), (7) bis‐acryl composite resin (PTP), (8) 3D printed splint (3DP). In each group, the position of modified impression copings was scanned with a laboratory scanner at different time points: (1) unsplinted impression copings (baseline), (2) 2 h after splinting, (3) 24 h after splinting. Modified impression coping design allowed using metrology software to measure and compare distance, vertical, angle and rotational deviations between impression copings. Results All types of splints showed dimensional deviations. After 2 h of splinting, the lowest distance deviation was recorded in PTR (15.4±6.15µm), vertical deviation – in ILC (19.2±27.37µm), angle deviation – in ILC (0.08±0.1°), rotation – in LXB (0.2±0.24°) groups. Comparing results 2 and 24 h after connection of impression copings, statistically significant deviations in the distance were recorded in groups PLA (-5.6±5.95 µm), PTR (5.5±7.01µm), ILN (19.2±14.26µm), PTP (23.8±12.55µm). Conclusions The best dimensional accuracy was observed in the ILC group, followed by PTR and 3DP groups. Clinical significance Proper selection of splinting technique and polymerization time can increase the accuracy of conventional or digital impressions. Splinting techniques with rigid materials, proper polymerization and compensating for material shrinkage seem to produce the best results.","","Implant impression, Accuracy, Splinting, 3D printing, Digital dentistry","",""
7,"","FEHRENBACH2022104283","Fehrenbach, Julia; Lacerda-Santos, Rogério; Machado, Lucas Silveira; Miotti, Leonardo Lambertti; de Carvalho, Fabíola Galbiatti; Münchow, Eliseu Aldrighi","Which self-etch acidic composition may result in higher dental bonds at the long-term? A network meta-analysis review of in vitro studies","Journal of Dentistry",126,,"","104283",2022,"","","https://www.sciencedirect.com/science/article/pii/S0300571222003396","","","","","","","","","","","","","Objectives This review evaluated the effects of the acidic composition of self-etch (SE) adhesives at the long-term bond strengths to dentin and enamel. Data The review followed the PRISMA Extension Statement for network meta-analysis. Studies were identified by a systematic search in PubMed, Web of Science, and Scopus databases. Study selection The inclusion criteria were in vitro studies that evaluated bond strength data of samples analyzed at both immediate and long-term (after aging simulation) periods and that were bonded to sound dentin/enamel using SE adhesives, with at least one group of adhesives being based on 10-MDP (10-methacryloyloxy-decyl-dihydrogen-phosphate; control) and the other group being comprised of alternative acidic monomers. Statistical analyses were conducted using two methods: standard pairwise meta-analysis (SPMA) and Bayesian network meta-analysis (NMA). Heterogeneity was assessed by using the Cochran Q test and I2 statistics. Results From 5220 studies identified, 87 met the eligibility criteria and 83 were meta-analyzed. Seventeen adhesives were based on 10-MDP and 44 systems were based on alternative acids. The resin-dentin/enamel bonds were predominantly reduced after aging (∼84% of cases). From the SPMA findings, the following acidic compositions showed lower bond strength values (effect size: mean difference [MD] with 95% confidence interval [95% CI]) than 10-MDP: 4-META (MD -4.99, 95% CI: -7.21, -2.78; p<0.001); sulfonic acids (MD -9.59, 95% CI -12.19, -6.98; p<0.001); unspecified phosphate esters (MD -8.89, 95% CI -17.50, -0.28; p = 0.04); or mixed acids (MD -11.0, 95% CI -13.62, -8.38; p<0.001). The dental bonds were benefited from the presence of 10-MDP upon longer aging (>6 months). From the NMA probabilistic findings, adhesives based on 10-MDP and phosphonic acids ranked as having the best and the worst bonding potential to dentin, respectively. More than one composition (phosphonic acids and mixed acids) ranked similarly to 10-MDP in enamel. The studies scored as having moderate risk of bias (58.6%), followed by low (39.1%) and high (2.3%) risk of bias. Conclusion 10-MDP is an outstanding acidic monomer that contributes to higher bonds to dentin at the long-term. In enamel, there is no evidence that one acidic composition prevails over the other. Clinical significance The acidic composition of SE adhesives affects the resistance of dental bonds after simulated aging, with 10-MDP playing a significant role in the adhesion to dentin but not to the enamel. Registration number This report is registered at the Open Science Framework (osf.io/urtdf).","","Dental bonding, Functional acidic monomer, Universal adhesives, Dentin, Enamel","",""
7,"","CHALLAKH2021103836","Challakh, Nadia; Palsa, Dennis; Bemmann, Maximilian; Merle, Cordula Leonie; Haak, Rainer; Schulz-Kornas, Ellen; Ziebolz, Dirk","Assessibility of different CAD/CAM ceramics with optical coherence tomography","Journal of Dentistry",114,,"","103836",2021,"","","https://www.sciencedirect.com/science/article/pii/S0300571221002591","","","","","","","","","","","","","Objectives To investigate the light penetration depth of various CAD/CAM ceramics and luting agents by spectral-domain optical coherence tomography (SD-OCT). Methods. Six CAD/CAM ceramics: lithium disilicate (LS2), zirconia-reinforced lithium silicate (ZLS), lithium aluminosilicate (LAS), polymer infiltrated (PIC), feldspar (FEL) and zirconium oxide (ZRO) and five common luting agents, two self-adhesive and three adhesive materials, were included. SD-OCT wavelengths (1310/1550 nm) and frequencies (5/28 kHz) that are particularly suitable for these materials were investigated. Subsequently, a clinical simulation was performed with an adhesively or self-adhesively inserted partial crown made of a ceramic that had an OCT penetration depth of > 1.0 mm. Results Best SD-OCT penetration was obtained at 1550 nm and 28 kHz. For ZLS, LS2 and LAS, SD-OCT light penetration depth of > 4 mm was shown. In contrast, the penetration depth of ZRO, PIC and FEL was less than 1 mm. Adhesive and self-adhesive luting agents could be visualized up to ≥ 0.9 mm. All clinically relevant areas (ceramic restoration, luting area, interfaces and adjacent tooth structures) can be imaged when SD-OCT-suitable ceramics are used. Conclusions SD-OCT can be used to analyze CAD/CAM ceramics based on ZLS, LS2 and LAS, whereas ZRO, PIC, and FEL had insufficient penetration depth for clinical application. The type of luting agent or its thickness played an insignificant role. With suitable ceramics, SD-OCT can be recommended as a non-invasive examination tool. Clinical Significance This study indicates that SD-OCT is a useful non-invasive examination method for monitoring lithium silicate-based ceramic restorations and adjacent structures.","","CAD/CAM, Ceramics, Luting agents, OCT","",""
7,"","ELTER2022104352","Elter, Bahar; Diker, Burcu; Tak, Önjen","The trueness of an intraoral scanner in scanning different post space depths","Journal of Dentistry",127,,"","104352",2022,"","","https://www.sciencedirect.com/science/article/pii/S0300571222004043","","","","","","","","","","","","","Objectives The purpose of this in vitro study was to evaluate the trueness of scanning the post space up to 20 mm with an intraoral scanner (IOS). Methods We captured 20-, 18-, 16-, 14-, 12-, and 10-mm length post space scans using an IOS (Primescan) eight times each by shortening the apical 2 mm end of the same mandibular canine tooth. The reference impressions of each length group were taken using a light-body polyvinyl siloxane impression material and were scanned with an extraoral scanner. The recorded standard tessellation language (STL) data of all impressions were uploaded to a 3D matching program for the trueness evaluation via the root mean square (RMS) calculation. For the statistical analysis, the Kruskal-Wallis and post-hoc Mann-Whitney U nonparametric tests were performed to compare the differences among the groups (α=0.05). Results The median RMS values increased in direct proportion to the length of the post space from 10 mm (357.1 µm) to 20 mm (897.5 µm). We noted a significant difference among groups (p< 0.001). In the pairwise comparisons, there were no significant differences between the 14 mm and 16 mm groups (p=0.431) or between the 18 mm and 20 mm groups (p=0.036), while other paired groups showed significant differences (p=0.001). Conclusions The scanned space depth affected the trueness of the IOS (Primescan). If the post depth was below 14 mm, and the minimum diameter was 2.2 mm, Primescan could be used for impressions of the post-core structure, simplifying the impression procedure. Clinical significance IOS seems to be a promising technology for taking digital impressions of post spaces, but cannot be recommended as a routine procedure at its present stage, as final results are highly dependent on the clinical situation. Further studies with different IOS systems are needed to gain sound evidence.","","Digital impression, Intraoral scanner, Post space impression, Trueness","",""
7,"","ABOUAYASH2021103784","Abou-Ayash, Samir; Schimmel, Martin; Özcan, Mutlu; Ozcelik, Burak; Brägger, Urs; Yilmaz, Burak","Trueness and marginal fit of implant-supported complete-arch fixed prosthesis frameworks made of high-performance polymers and titanium: An explorative in-vitro study","Journal of Dentistry",113,,"","103784",2021,"","","https://www.sciencedirect.com/science/article/pii/S0300571221002074","","","","","","","","","","","","","Purpose To investigate the trueness and marginal fit of computer-aided design–computer-aided manufactured (CAD-CAM) complete-arch implant-supported screw-retained fixed prosthesis (CAISFP) made of polyetheretherketone (PEEK), polyetherketoneketone (PEKK) and titanium (Ti) Material and methods A typodont model with four implants, their multiunit abutments (MUAs), and MUA scanbodies were digitized by using a laboratory scanner. The generated CAD was used to mill CAISFP frameworks in Ti, PEEK, or PEKK (each n = 10). The frameworks were digitized with an industrial light scanner to superimpose resulting standard tessellation language (STL) file with the CAD file. Deviations at five points at the abutment-framework interface of each of the four abutment sites (1:left first molar, 2:left canine, 3:right canine, 4:right first molar sites) were calculated (trueness). Marginal gaps were measured using the triple scan technique. A nonparametric repeated measures ANOVA by Brunner and Puri with factors being abutment location and material was performed to assess the mean deviations for trueness and mean marginal gaps, followed by Mann-Whitney or exact Wilcoxon Signed-Rank tests (alpha=.05). Results Material type significantly affected the trueness (p<0.0001). PEEK had the lowest deviations (0.039 +/-0.01mm) followed by PEKK (0,049 +/-0.009mm), and Ti (0.074 +/-0.011mm). For marginal gaps, only abutment location's effect was significant (p = 0.003). Within PEKK, gaps at abutment 4 were significantly larger, compared with abutments 2 (p = 0.04) and 3 (p = 0.02). Conclusions The trueness of PEEK, PEKK, and Ti frameworks was different after milled. PEEK had the highest trueness. However, the marginal fit of the frameworks was similar and smaller than 90 µm in average. Clinical Relevance PEEK, PEKK, and Ti complete-arch frameworks had clinically acceptable gaps and may therefore be recommended when their fit is considered. Higher trueness after milling did not result in better marginal fit.","","Trueness, Marginal fit, CAD-CAM, Fit analysis, PEEK, PEKK, High-performance polymers","",""
7,"","DESOUZA20197","de Souza, Lidiane Costa; Rodrigues, Nara Sousa; Cunha, Diana Araújo; Feitosa, Victor Pinheiro; Santiago, Sérgio Lima; Reis, Alessandra; Loguercio, Alessandro Dourado; de Paris Matos, Thalita; de Paulo Aragão Saboia, Vicente; Perdigão, Jorge","Two-year clinical evaluation of proanthocyanidins added to a two-step etch-and-rinse adhesive","Journal of Dentistry",81,,"","7-16",2019,"","","https://www.sciencedirect.com/science/article/pii/S0300571218306778","","","","","","","","","","","","","Objective To compare the clinical behavior of Proanthocyanidins (PA)-free and PA-containing two-step etch-and-rinse adhesive used underneath resin composite restorations in non-carious cervical lesions (NCCLs) over a 6- (6 M) and 24-month (24 M) period. Methods 135 restorations were randomly placed in 45 subjects. The NCCLs were conditioned (37% phosphoric acid for 15 s) and distributed into 3 groups: Control (EX0) - ExciTE F (Ivoclar Vivadent) adhesive applied following the manufacturer's recommendations; EX2 and EX5 – 2 wt% and 5 wt% of PA were added to ExciTE F, respectively, and applied as in EX0. Resin composite was placed incrementally and light-cured. The restorations were evaluated at baseline, 6 M and 24 M, using FDI and USPHS criteria. Statistical analyses were performed using Friedman and Wilcoxon tests (α = 0.05). Results The retention rates were 98% (95% confidence interval 88–99%) for EX0, 92% (80–97%) for EX2; and 85% (72–93%) for EX5 at 6 M. A significant difference was found only for EX5 at 6 M when compared with the respective baseline findings (p = 0.03) and when compared with EX0 and EX2 (p = 0.001) at 6 M. After 24 M, the retention rates were 98% (88–99%) for EX0, 73% (59–84%) for EX2, and 71% (56–82%) for EX5. Only EX0 did not result in significant difference in retention rate at 24 M when compared with baseline but showed a significant higher retention rate when compared with those of EX2 and EX5 (p = 0.001). Conclusion Adding proanthocyanidins to the adhesive solution jeopardized the retention of composite resins restorations in non-carious cervical lesions after 24 months. Clinical relevance In spite of being user-friendlier than when used separately, the incorporation of proanthocyanidins into the adhesive solution impairs the longevity of composite restorations.","","Dentin-bonding agents, Non-carious cervical lesions, Proanthocyanidins, Longevity, Clinical trial","",""
7,"","YAP2023104683","Yap, Rei Chiel; Alghanem, Meshal; Martin, Nicolas","A narrative review of cracks in teeth: Aetiology, microstructure and diagnostic challenges","Journal of Dentistry",138,,"","104683",2023,"","","https://www.sciencedirect.com/science/article/pii/S0300571223002695","","","","","","","","","","","","","Objectives To summarize the available evidence of crack formation in teeth and to discuss the limitations of the current clinical diagnostic modalities for crack detection in teeth. Background Cracks are a common clinical finding in teeth and yet clinicians still struggle to identify the full extent and orientation of cracks for their appropriate timely management. The biomechanics of crack development can be due to multiple factors and can differ from an unrestored tooth to a restored or endodontically treated tooth. Data & sources This narrative review has been designed following the guidelines published by Green et al. 2006 [1] Published literature in the English language that addresses the objectives of this review up to July 2022 was sourced from online databases and reference lists. The relevance of the papers was assessed and discussed by two reviewers. A total of 101 publications were included in this narrative review. Conclusions The initiation and development of cracks in teeth are likely linked to an interplay between the masticatory forces and fracture resistance of the remaining tooth structure. From the identified literature, the quality and quantity of remaining tooth structure in a restored or endodontically-treated tooth affects the biomechanics of crack development compared to an unrestored tooth. The extent, orientation, and size of the cracks do affect a clinician's ability to detect cracks in teeth. There is still a need to develop reliable diagnostic tools that will accurately identify cracks in teeth beneath restorations to enable effective monitoring of their propagation and provide appropriate interventions. Clinical significance The development and propagation of cracks in an unrestored tooth differ greatly from a restored and endodontically treated tooth; mainly linked to the quantity and quality of the remaining tooth structure and the forces acting on them. Identifying the extent of cracks in teeth remains challenging for early clinical intervention.","","Cracked tooth, Fractured tooth, Cracked tooth syndrome, Dental crack propagation","",""
7,"","VAFAEI2022103890","Vafaei, Ali; Nikookhesal, Mahsa; Erfanparast, Leila; Løvschall, Henrik; Ranjkesh, Bahram","Vital pulp therapy following pulpotomy in immature first permanent molars with deep caries using novel fast-setting calcium silicate cement: A retrospective clinical study","Journal of Dentistry",116,,"","103890",2022,"","","https://www.sciencedirect.com/science/article/pii/S0300571221003122","","","","","","","","","","","","","Objectives To compare the success rate of vital pulp therapy following complete pulpotomy in immature first permanent molars, during caries treatment, using novel fast-setting calcium silicate cement (Novel CSC) versus MTA. Methods Six- to eight- years old children, who received pulpotomy of first immature permanent molar using one layer novel CSC (Protooth) or two layers slow-setting MTA (MTA Angelus) covered with glass ionomer were recalled for radiographic and clinical evaluation after two years. The effects of cement type, age, gender, jaw, anesthesia type, and restoration type were assessed on the clinical success of pulpotomy and continued root formation (apexogenesis) as the treatment outcome. Results Out of 366 included teeth in the study, 316 teeth were available for statistical analysis. The mean observation time was 28.2 ± 2.7 months. Novel CSC showed significantly higher clinical success rate (93.1%) compared to MTA (84.5%). Restored teeth with stainless steel crowns after pulpotomy and treatments performed under general anesthesia had a statistically significant effect on treatment outcome in contrast to age, gender, and jaw type. Conclusion The observations of this retrospective study suggested that the success rate of vital pulp therapy following complete pulpotomy using one layer fast-setting novel CSC was significantly higher than slow-setting MTA covered with glass ionomer. Treatment under general anesthesia and restoration using stainless steel crowns influenced the treatment outcome. Clinical significance Novel fast-setting calcium silicate cement is a promising new biomaterial for vital pulp therapy in immature permanent molars that allows complete root formation overtime with apexogenesis. Clinicians must also be aware of the importance of immediate definitive restoration and proper sealing and isolation in vital pulp therapy.","","Calcium silicate cement, Pulpotomy, Apexogenesis, Vital pulp therapy","",""
7,"","CHEN2023104452","Chen, Xuefei; Inoue, Go; Ikeda, Masaomi; Sadr, Alireza; Shimada, Yasushi","Time-dependent structural changes and hypermineralisation of artificially demineralised dentine following treatment with silver diammine fluoride and glass ionomer cement","Journal of Dentistry",131,,"","104452",2023,"","","https://www.sciencedirect.com/science/article/pii/S0300571223000398","","","","","","","","","","","","","Objectives This study aimed to evaluate the change of mineral content in dentine lesions over time and examine the effectiveness of the combined treatment with silver diammine fluoride (SDF) and glass ionomer cement (GIC). Methods Sixty bovine dentine specimens were divided into 4 groups: cont, Fuji, Safo, and Safo+Fuji. The specimens were imaged and measured using microcomputed tomography (microCT) at 7 time points: pre-demineralisation, after demineralisation for two weeks, immediately after treatment, 1 week, 2 weeks, 1 month, and 3 months after treatment. The 3-month group was evaluated with a light microscope, attenuated total reflectance–Fourier transform infrared (ATR-FTIR) spectroscopy, and scanning electron microscope (SEM)/energy-dispersive X-ray spectroscopy (EDS). Data were analysed by Dunn's test and Wilcoxon signed rank test with Bonferroni correction for microCT, and Kruskal–Wallis test and two-way analysis of variance for EDS characterisation. Results MicroCT images showed high mineral density beneath dentine lesions in Safo+Fuji. The mineral density at 600 μm in Safo+Fuji increased significantly over time, while Safo showed an opposite trend (adjusted p<0.005). In Safo+Fuji, EDS revealed significantly high energy of fluorine (p<0.05, at 300 μm) and a tendency towards high energy of calcium (p>0.05). However, Safo+Fuji showed lower energy of silver compared to Safo (p<0.001). ATR-FTIR revealed that phosphate groups had the highest peak at a depth between 300 and 400 μm in Safo+Fuji. Conclusions Safo+Fuji was effective in remineralising the deep lesion in dentine after one and three months, and a hypermineralisation zone generated beneath the lesion demonstrated additional benefit in this study. Clinical significance This long-term in vitro study showed that SDF+GIC treatment could strengthen the structure of decayed teeth when applied in the treatment of patients with advanced rampant caries.","","Remineralisation, Silver diammine fluoride, Glass ionomer cement, Caries arrest, microCT, Dentine","",""
7,"","QUEIROZLIMA2022104348","Queiroz-Lima, Glívia; Strazzi-Sahyon, Henrico Badaoui; Maluly-Proni, Ana Teresa; Fagundes, Ticiane Cestari; Briso, André Luiz Fraga; Assunção, Wirley Gonçalves; Delben, Juliana Aparecida; Santos, Paulo Henrique Dos","Surface characterization of indirect restorative materials submitted to different etching protocols","Journal of Dentistry",127,,"","104348",2022,"","","https://www.sciencedirect.com/science/article/pii/S0300571222003955","","","","","","","","","","","","","Objectives This in vitro study aimed to evaluate the effect of different times and concentrations of hydrofluoric acid etching on the surface of indirect restorative materials obtained from blocks used in CAD-CAM technology. Methods Specimens (4 mm × 4 mm × 0.8 mm) were obtained for each indirect restorative material: zirconia-reinforced lithium monosilicate ceramic (Celtra Duo), nanoceramic resin (Lava Ultimate), and polymer-infiltrated ceramic network material (Vita Enamic). The materials were submitted to etching with 5% or 10% hydrofluoric acid for 20, 40, 60, or 90 s. A control group for each material was evaluated without any surface treatment, totaling nine experimental groups for each material (n = 10). The specimens were evaluated for surface roughness (Ra and Rz), confocal optical microscopy, the contact angle (θ), surface free energy (γs), total free interaction energy (∆G) using a goniometer, and microshear bond strength to resin cement. Specimen images were obtained using scanning electron microscopy, confocal optical microscopy, and atomic force microscopy. Data on the surface roughness, the contact angle, surface free energy, total free interaction energy, and bond strength were subjected to two-way ANOVA and Tukey´s test (α=0.05). Results In general, Celtra Duo showed better results after etching with 10% hydrofluoric acid for 40 or 60 s. Lava Ultimate showed better performance after etching with 10% hydrofluoric acid for 20 or 40 s, whereas Vita Enamic showed better results after etching with 5% hydrofluoric acid for 90 s. Conclusion Each material showed different characteristics after etching with hydrofluoric acid. Knowledge of the proper protocol for each material is essential to ensure improvements in the adhesion process and durability of indirect restorations. In general, Celtra Duo presented mechanical properties superior to those of Lava Ultimate and Vita Enamic. Clinical Significance Specific etching protocols must be recommended for each indirect material because longer exposure to hydrofluoric acid can jeopardize the surface, thus affecting the mechanical and bond strength properties.","","Bond strength, Surface properties, Hydrofluoric acid, Microscopy electron scanning, Microscopy atomic force","",""
