http://www.semanticweb.org/ontologies/2022/titutuli/nivedita/drmo#bibliographyType,http://purl.org/dc/terms/identifier,http://purl.org/dc/terms/creator,http://purl.org/dc/terms/title,http://purl.org/dc/terms/source,http://purl.org/ontology/bibo/volume,http://www.semanticweb.org/ontologies/2022/titutuli/nivedita/drmo#number,http://purl.org/ontology/bibo/pages,http://www.semanticweb.org/ontologies/2022/titutuli/nivedita/drmo#yearPublished,http://purl.org/ontology/bibo/uri,http://purl.org/dc/terms/abstract,http://www.semanticweb.org/ontologies/2022/titutuli/nivedita/drmo#keywords
7,PERDUNS20191214,"Perduns, Renke; Volk, Joachim; Plum, Melanie; Gutzki, Frank; Kaever, Volkhard; Geurtsen, Werner",Effects of HEMA on Nrf2-related gene expression using a newly developed 3D co-culture model of the oral mucosa,Dental Materials,35,9,1214-1226,2019,https://www.sciencedirect.com/science/article/pii/S0109564119301496,"Objective 2-Hydroxyethyl methacrylate (HEMA) is a component of many resin-modified materials and elutes from dental restorations into the oral cavity. Objective of our investigation was to determine the impact of HEMA on oral keratinocytes (OKF6/TERT2) and gingival fibroblasts (HGFs) in a newly established 3D co-culture model (3D-CCM) and to analyze the permeability of OKF6/TERT2 cells for HEMA. Methods Well-characterized 3D-CCMs, consisting of confluent OKF6/TERT2 cells on cell culture inserts above HGF-containing collagen gels, were treated supra-epithelial with HEMA. Mass spectrometry was used to measure the supra- and sub-epithelial distribution of HEMA after 24 h. The impact of HEMA on nuclear factor erythroid 2-related factor 2 (Nrf2) target genes was measured by qRT-PCR and western blot analysis. Results Mass spectrometry showed that HEMA was evenly distributed above and below the keratinocyte layer after 24 h. Analyzed target genes of Nrf2 were induced in both cell types on the mRNA-level but less pronounced in HGFs. On the protein-level, both cell types showed similar effects: At 5 mM HEMA, heme oxygenase-1 was induced 5.1-fold in OKF6/TERT2 cells and 4.1-fold in HGFs. NAD(P)H quinone dehydrogenase-1 was approximately induced 1.85-fold in both cell types. Significance Our 3D-CCM is suitable to analyze the biocompatibility of dental materials due to an improved simulation of the oral mucosa compared to monolayer cultures. Our results indicate that HEMA is able to penetrate a dense layer of keratinocytes and to activate the cellular oxidative defense response. This may be due to the activation of the Nrf2-pathway in both cell types.","HEMA, Oral keratinocytes, Gingival fibroblasts, 3D co-culture, Redox-regulated gene expression"
7,TOLEDANO202341,"Toledano, Manuel; Osorio, Estrella; Aguilera, Fátima S.; Osorio, María T.; Toledano, Raquel; López-López, Modesto T.; Lynch, Christopher D.; Osorio, Raquel",Dexamethasone and zinc loaded polymeric nanoparticles reinforce and remineralize coronal dentin. A morpho-histological and dynamic-biomechanical study,Dental Materials,39,1,41-56,2023,https://www.sciencedirect.com/science/article/pii/S0109564122003220,"Objective To investigate the effect of novel polymeric nanoparticles (NPs) doped with dexamethasone (Dex) on viscoelasticity, crystallinity and ultra-nanostructure of the formed hydroxyapatite after NPs dentin infiltration. Methods Undoped-NPs, Dex-doped NPs (Dex-NPs) and zinc-doped-Dex-NPs (Zn-Dex-NPs) were tested at dentin, after 24 h and 21 d. A control group without NPs was included. Coronal dentin surfaces were studied by nano-dynamic mechanical analysis measurements, atomic force microscopy, X-ray diffraction and transmission electron microscopy. Mean and standard deviation were analyzed by ANOVA and Student-Newman-Keuls multiple comparisons (p < 0.05). Results At 21 d of storage time, both groups doped with Dex exhibited the highest complex, storage and loss moduli among groups. Zn-Dex-NPs and Dex-NPs promoted the highest and lowest tan delta values, respectively. Dex-NPs contributed to increase the fibril diameters of dentin collagen over time. Dentin surfaces treated with Zn-Dex-NPs attained the lowest nano-roughness values, provoked the highest crystallinity, and produced the longest and shortest crystallite and grain size. These new crystals organized with randomly oriented lattices. Dex-NPs induced the highest microstrain. Crystalline and amorphous matter was present in the mineral precipitates of all groups, but Zn and Dex loaded NPs helped to increase crystallinity. Significance Dentin treated with Zn-Dex-NPs improved crystallographic and atomic order, providing structural stability, high mechanical performance and tissue maturation. Amorphous content was also present, so high hydroxyapatite solubility, bioactivity and remineralizing activity due to the high ion-rich environment took place in the infiltrated dentin.","Apatite, Dentin, Dexamethasone, Polymeric nanoparticles, Remineralization, Transmission electron microscopy, Viscoelastic, X-ray diffraction, Zinc"
7,AHMED202130,"Ahmed, M. H.; Yoshihara, K.; Yao, C.; Okazaki, Y.; Van Landuyt, K.; Peumans, M.; Van Meerbeek, B.",Multiparameter evaluation of acrylamide HEMA alternative monomers in 2-step adhesives,Dental Materials,37,1,30-47,2021,https://www.sciencedirect.com/science/article/pii/S0109564120302773,"Objective As frequently added to adhesives, the mono-functional monomer 2-hydroxyethyl methacrylate (HEMA) acts as co-solvent and improves surface wetting. Nevertheless, HEMA promotes watersorption and hydrolysis at adhesive interfaces, affecting bond durability to dentin. This study investigated if two acrylamide co-monomer alternatives could replace HEMA in experimental adhesive-resin formulations as part of 3/2-step universal adhesives applied, respectively, in etch-and-rinse (E&R) and self-etch (SE) bonding modes. Methods Upon priming dentin with the 10-MDP-based Clearfil SE Bond 2’ primer (‘C-SE2p’; Kuraray Noritake), three experimental adhesive resins, consisting of 50 wt.% Bis-GMA, 15 wt.% TEGDMA, and either 35 wt.% diethyl acrylamide (‘DEAA’), hydroxyethyl acrylamide (‘HEAA’) or HEMA (‘HEMA+’), were applied. The control HEMA-free adhesive resin contained 60 wt.% Bis-GMA and 40 wt.% TEGDMA (‘HEMA−’). All adhesives were evaluated for ‘immediate’ and ‘aged’ micro-tensile bond strength (μTBS) to dentin upon, respectively, 1-week (1w) and 6-month (6m) water storage, TEM adhesive-dentin interfacial interaction, 24-h and 6m three-point bending, contact-angle wetting, viscosity and watersorption. Results Linear mixed-effects model statistics revealed significantly better bonding performance of the adhesives applied in E&R than SE mode, except for DEAA_1w, with the highest μTBSs recorded for DEAA and HEMA− applied in SE mode. In E&R mode, aging did not significantly reduce DEAA’s μTBS. Best wetting on primed dentin was recorded for HEMA+, significantly better than DEAA, further HEAA and HEMA−, these directly related to their viscosity. HEAA absorbed significantly more water than all other adhesive-resin formulations. HEMA−>DEAA>HEAA>HEMA+ was the significant order for 6m bending strength. Conclusions The acrylamide co-monomer DEAA could replace HEMA, while HEAA not.","HEMA, Durability, Acrylamides, Linear mixed-effects model (LME), TEM, Bond strength"
7,HASS20211794,"Hass, Viviane; Liu, Hang; Cook, Walter; Walker, Mary P.; Wang, Yong",Distinct effects of polyphenols and solvents on dentin collagen crosslinking interactions and biostability,Dental Materials,37,12,1794-1805,2021,https://www.sciencedirect.com/science/article/pii/S0109564121002645,"Objective To evaluate the effects of different polyphenols and solvents on dentin collagen’s crosslinking interactions and biostabilization against MMPs and collagenase degradation. Methods Two polyphenols [proanthocyanidin (PA) and quercetin (QC)] with different water solubility were prepared as treatment solutions using ethanol (EtOH) or dimethyl sulfoxide (DMSO) as solvents. 6-um-thick dentin films were microtomed from dentin slabs of third molars. Following demineralization, films or slabs were subject to 60-s treatment (PA or QC) or no treatment (control) with subsequent extended-rinse with original solvent (EtOH or DMSO) or distilled water (DW). Collagen crosslinking interactions were assessed by FTIR. Biostability was assessed through endogenous MMPs activity via confocal laser scanning microscopy, and exogenous collagenase degradation via weight loss, hydroxyproline release and SEM. Finally, direct collagenase inactivation was also evaluated. Data were analyzed by three-way ANOVA and post-hoc tests (α=0.05%). Results Distinct effects of two polyphenols and solvents on collagen crosslinking and biostabilization were observed. Higher crosslinking and biostability efficacy occurred with PA than QC (p<0.001) that demonstrated negligible collagen interactions. With DMSO solvent, efficacy results were significantly reduced with both polyphenols (p<0.05). DMSO-rinse further weakened interactions of PA with collagen, diminishing biostability (p<0.05). Low biostability was detected with QC and DW-rinse, suggesting direct enzymatic inhibition due to physical presence in collagen. Significance Collagen crosslinking interactions and biostability depend on polyphenol chemical characteristics. Treatment-solution solvents may affect interactions between polyphenols and collagen, specifically, DMSO showed detrimental effects on collagen crosslinking and biostability and should be used with caution.","Collagen crosslinking, Dentin, Polyphenols, Proanthocyanidin, Quercetin, Dimethyl sulfoxide"
7,JENNES20221532,"Jennes, Marie-Elise; Tomakidi, Pascal; Husari, Ayman; Hellwig, Elmar; Polydorou, Olga; Schulz, Simon Daniel",Response of human gingival keratinocytes to hybrid CAD/CAM material eluates,Dental Materials,38,9,1532-1546,2022,https://www.sciencedirect.com/science/article/pii/S0109564122002172,"Objectives The aim of this study was to investigate the influence of hybrid CAD/CAM-blocks on immortalized human gingival keratinocytes (HGK). Methods Samples of two different hybrid CAD/CAM materials [Lava™ Ultimate (3 M); VITA Enamic® (VITA Zahnfabrik)], a composite material [ceram.x® universal (Dentsply Sirona)] and a CAD/CAM ceramic [VITABLOCS® (VITA Zahnfabrik)] were stored in cell culture medium for 72 h to prepare eluates according to ISO-10993–12:2012. HGK were exposed to eluates for 6, 24 and 48 h. Cell monitoring was performed by RTCA iCELLigence™ system. The morphological changes were evaluated using phase contrast imaging. Specific biomarkers of apoptosis and terminal differentiation (Caspase-3, Involucrin) were analyzed semi quantitatively by indirect immunofluorescence (IIF). Protein levels and activation of MAP kinases ERK1/2 (p44/42) were quantified by Western blot. Data were statistically analyzed by unpaired t-test (p < 0.05). Results Regarding Vita Enamic® and Lava™ Ultimate, results of RTCA iCELLigence™ and Western blots showed no statistically significant differences (p > 0.05) compared to the negative control (HGK in native keratinocyte growth medium). No aberrant expression of Caspase-3 and Involucrin was detected in cells incubated with Vita® Enamic eluates Cells incubated with Lava™ Ultimate showed a higher expression of Involucrin after 24 h of incubation compared to the negative control. Statistically significant differences (p < 0.01) were found between cells incubated with ceram.x® universal and the negative control in RTCA iCELLigence™ assay and in quantitative measurements of Western blots after 6 h against phospho-p44/42 (p = 0.044). Increased expression of Caspase-3 and Involucrin were detected by IIF in cells after incubation with eluates of ceram.x® universal. Significance The present data show no significant effect of hybrid materials on analyzed functions of cell behavior. A cytotoxic influence of ceram.x® universal eluates was observed in HGK in terms of a strong modulation of proliferation, morphology and protein expression.","Dental material, Hybrid ceramic, Composite materials, Gingival keratinocytes, Proliferation, Differentiation, Apoptosis"
7,HOSHIKA2021106,"Hoshika, Shuhei; Ting, Shihchun; Ahmed, Zubaer; Chen, Fei; Toida, Yu; Sakaguchi, Norihito; Van Meerbeek, Bart; Sano, Hidehiko; Sidhu, Sharanbir K.",Effect of conditioning and 1 year aging on the bond strength and interfacial morphology of glass-ionomer cement bonded to dentin,Dental Materials,37,1,106-112,2021,https://www.sciencedirect.com/science/article/pii/S0109564120302931,"Objective The purpose of this study was to determine the bond stability and the change in interfacial ultra-structure of a conventional glass-ionomer cement bonded to dentin, with and without pre-treatment using a polyalkenoic acid conditioner. Methods The occlusal dentin surfaces of six teeth were ground flat. Glass-ionomer cement was bonded to the surfaces either with or without polyalkenoic acid conditioning. The teeth were sectioned into 1-mm2 stick-shaped specimens. The specimens obtained were randomly assigned to two groups with different periods of storage in water: 1 week and 1 year. The micro-tensile bond strength (μTBS) was determined for each storage time. Additional specimens were prepared for Transmission Electron Microscopy (TEM); they were produced with or without prior polyalkenoic acid conditioning in the same way as in the μTBS test. Results There was no significant difference in μTBS to conditioned dentin and non-conditioned dentin (p > 0.05). The failures appeared to be of a mixed nature, although aging caused more areas of cohesive than adhesive failure in both groups. The TEM observation showed an intermediate layer, a matrix-rich layer and a partially demineralized layer in the polyalkenoic acid conditioned group. Significance Aging did not reduce the bond strength of the conventional glass-ionomer cement to dentin with or without the use of a polyalkenoic acid conditioner.","Adhesion, Dentin, Glass-ionomer cement, Micro-tensile bond strength, Transmission Electron Microscopy"
7,SPAGNUOLO20211734,"Spagnuolo, Gianrico; Pires, Paula Maciel; Calarco, Anna; Peluso, Gianfranco; Banerjee, Avijit; Rengo, Sandro; Elias Boneta, Augusto R.; Sauro, Salvatore","An in-vitro study investigating the effect of air-abrasion bioactive glasses on dental adhesion, cytotoxicity and odontogenic gene expression",Dental Materials,37,11,1734-1750,2021,https://www.sciencedirect.com/science/article/pii/S0109564121002487,"Objective To assess the microtensile bond strength (MTBS) and interfacial characteristics of universal adhesives applied on dentine air-abraded using different powders. The analysis includes the cytotoxicity of the powders and their effect on odontogenic gene expression. Methods Sound human dentine specimens were air-abraded using bioglass 45S5 (BAG), polycarboxylated zinc-doped bioglass (SEL), alumina (AL) and submitted to SEM analysis. Resin composite was bonded to air-abraded or smear layer-covered dentine (SML) using an experimental (EXP) or a commercial adhesive (ABU) in etch&rinse (ER) or self-etch (SE) modes. Specimens were stored in artificial saliva (AS) and subjected to MTBS testing after 24 h and 10 months. Interfacial nanoleakage assessment was accomplished using confocal microscopy. The cytotoxicity of the powders was assessed, also the total RNA was extracted and the expression of odontogenic genes was evaluated through RT-PCR. Results After prolonged AS storage, specimens in the control (SML) and AL groups showed a significant drop in MTBS (p > 0.05), with degradation evident within the bonding interface. Specimens in BAG or SEL air-abraded dentine groups showed no significant difference, with resin-dentine interfaces devoid of important degradation. The metabolic activity of pulp stem cells was not affected by the tested powders. SEL and BAG had no effect on the expression of odontoblast differentiation markers. However, AL particles interfered with the expression of the odontogenic markers. Significance The use of bioactive glass air-abrasion may prevent severe degradation at the resin-dentine interface. Unlike alumina, bioactive glasses do not interfere with the normal metabolic activity of pulp stem cells and their differentiation to odontoblasts.","Air-abrasion, Biocompatibility, Bonding, Dentine, Odontogenic gene expression, Resin-dentine interface"
7,LI2021e245,"Li, Ke; Kou, Huamin; Rao, Jiancun; Liu, Cheng; Ning, Congqin",Fabrication of enamel-like structure on polymer-infiltrated zirconia ceramics,Dental Materials,37,4,e245-e255,2021,https://www.sciencedirect.com/science/article/pii/S0109564121000221,"Objectives The aim of this study is to improve the biological and mechanical properties of zirconia-based PICN (polymer-infiltrated-ceramic-network) materials by fabrication an enamel-like structure on its surface. Methods Fluorapatite (FA) arrays were fabricated on zirconia discs by hydrothermal treatment. After polymer infiltration, an enamel-like structure was obtained on zirconia-based PICN materials. Effects of hydrothermal treatment conditions on the FA arrays were investigated by XRD, FTIR and SEM. Human gingival fibroblast cells (HGFs) and Escherichia coli (E. coli) were used to evaluate the cytocompatibility and antibacterial properties. Nanoindentation method was employed to determine elastic modulus and hardness. Results A facile and pervasive method was developed in this study to fabricate an enamel-like structure constituted of controlled FA arrays and interstitial resin on zirconia-based PICN materials. The obtained FA arrays can significantly promote the adhesion and proliferation of human gingival fibroblasts (HGFs), and further effectively inhibit the growth of Escherichia coli. Owing to the hierarchical structure, the enamel-like structure has achieved a hardness of 1.79 GPa and a lower Young’s modulus of 37.4 GPa. Significances The enamel-like structure, with excellent biological and mechanical properties, is promising for various applications in dentistry.","Enamel, Fluorapatite arrays, Zirconia, Antibacterial property"
7,KOENIG20211134,"Koenig, V.; Bekaert, S.; Dupont, N.; Vanheusden, A.; Le Goff, S.; Douillard, T.; Chevalier, J.; Djaker, N.; Lamy de la Chapelle, M.; Amiard, F.; Dardenne, N.; Wulfman, C.; Mainjot, A.",Intraoral low-temperature degradation of monolithic zirconia dental prostheses: Results of a prospective clinical study with ex vivo monitoring,Dental Materials,37,7,1134-1149,2021,https://www.sciencedirect.com/science/article/pii/S0109564121001111,"Objective To investigate the intraoral development and kinetics of low-temperature degradation (LTD) in second-generation 3 mol.% yttria-doped tetragonal zirconia polycrystal (3Y-TZP) monolithic prostheses, as well as the influence of masticatory mechanical stress and glaze layer on it. Methods A total of 101 posterior tooth elements were included in a prospective clinical study, which included ex vivo LTD monitoring (at baseline, 6 months, 1 year, and 2 years) using Raman spectroscopy (n = 2640 monoclinic phase measurement points per evaluation time) and SEM. Four types of areas (1–2 mm2 surface, 6 on molars, and 4 on premolars) were analyzed on each element surface: occlusal, axial, glazed, or unglazed. Raman depth mapping and high-resolution SEM were performed on the selected samples. Results LTD developed in 3Y-TZP monolithic restorations 6 months after intraoral placement and progressed with time. After two years, the tetragonal-to-monoclinic transformation was non-uniform, with the presence of localized clusters of transformed grains. In axial areas, the grain aspect was typical of the classical nucleation-growth process reported for LTD, which progresses from the surface to a depth of several tens of microns. However, in occlusal areas, tribological stress generated surface crushing and grain pull-out from the clusters, which induced an underestimation of the aging process when the evaluation was limited to monoclinic phase quantification. Glazing cannot be considered a protection against LTD. Significance If LTD occurs in dental prostheses in the same way as in orthopedic prostheses, its clinical impact is unknown and needs to be further studied.","3Y-TZP, Computer-aided design/computer-aided manufacturing, Raman spectroscopy, transformation, Aging, Biomaterials"
7,FUGOLIN20201028,"Fugolin, Ana P.; Lewis, Steven; Logan, Matthew G.; Ferracane, Jack L.; Pfeifer, Carmem S.",Methacrylamide–methacrylate hybrid monomers for dental applications,Dental Materials,36,8,1028-1037,2020,https://www.sciencedirect.com/science/article/pii/S0109564120301329,"Objectives The susceptibility of methacrylates to hydrolytic and enzymatic degradation may be a contributing factor limiting the clinical lifespan of resin composite restorations. The elimination of labile ester bonds is a potential advantage of methacrylamides, which have been shown to produce more stable restorative interfaces. The rationale of this study is to design hydrolytically and enzymatically stable adhesive monomers, with the added benefit of being able to form crosslinked networks. The objective of this study was to synthesize difunctional, hybrid methacrylate-methacrylamide monomers, and evaluate them as potential monomers for dental adhesives. Materials and methods HEMA, TEGDMA (controls) or secondary methacrylamides (HEMAM – commercially available, 2EM and 2dMM – newly synthesized) either bearing a hydroxyl group or a methacrylate functionality (Hybrids-Hy), were added at 40mass% to bisGMA. The photoinitiator system consisted of 2-dimethoxyphenyl acetophenone (DMPA) and diphenyl iodonium hexafluorophosphate (DPI-PF6) at 0.2 and 0.4mass%, respectively. Polymerization kinetics were followed in real-time by near-IR spectroscopy during light activation at 630mW/cm2 for 300s. Water sorption and solubility (WS, SL) were measured according to ISO 4049. Storage modulus in shear (G′) for 300s was obtained by oscillatory rheometry. For the microtensile bond strength (μTBS), fully formulated adhesives containing 40vol% ethanol were used to restore caries-free human third molars. Bonded specimens with 1mm2 cross-sectional area were tested after 48h and 6 months storage in water at 37°C. Single bond (SB) was tested as a commercial control. Data were analysed with one-way ANOVA and Tukey's test and Student's t-test (α=0.05). Results In general, hybrid versions showed lower polymerization rate and degree of conversion, whereas the methacrylate controls, HEMA and TEGDMA, showed the highest values. The hybrid versions showed lower values of WS and SL than their monofunctional versions. HEMAM Hy showed the highest values of G′ and TEGDMA, 2EM, and 2dMM-Hy the lowest. The μTBS values between 48h and 6 months were statistically reduced only for the HEMA and both 2dMM materials. The formulation containing the monofunctional methacrylamide (HEMAM) showed only 9% reduction in μTBS after 6 months of aging, while the other groups showed a decrease ranging between 18% and 33%. Conclusion Overall, hybrid monomers showed lower reactivity than their analogous monofunctional versions, but had markedly lower water sorption. Shear storage modulus was affected differently by the addition of the second functionality. HEMAM-containing systems were able to maintain stable long-term dentin bond strength, which demonstrates that bonding stability is a result of the complex interplay among the factors studied. Clinical significance The novel monomers showed here are potential alternatives to the current methacrylate adhesives, with selected formulations presenting greater bond stability.","Dental materials, Hybrids, Methacrylate, Methacrylamide, Restorative dentistry, Adhesives"
